428,Brachionus plicatilis A,0.126,Brachionidae,Brachionus,plicatilis,0.126,NC,Adult,Invert,,,Brachionus plicatilis,Brachionidae Brachionus plicatilis Adult,Brachionidae Brachionus plicatilis 429,Foraminefera A,1,Foraminefera,,,1,NC,Adult,Invert,,,Foraminefera ,Foraminefera Adult,Foraminefera 430,Penaeus semisulcateus J4,70,Penaeidae,Penaeus,semisulcateus,70,C,Juvenile,Invert,,,Penaeus semisulcateus Juveniles ,Penaeidae Penaeus semisulcateus Juvenile,Penaeidae Penaeus semisulcateus 431,Apanthura sandalensis A,10,Anthuridae,Apanthura,sandalensis,10,NC,Adult,Invert,,,Apanthura sandalensis,Anthuridae Apanthura sandalensis Adult,Anthuridae Apanthura sandalensis 432,Parapenaeopsis stylifera E,0.365,Penaeidae,Parapenaeopsis,stylifera,0.365,C,Egg,Invert,,,Parapenaeopsis stylifera eggs,Penaeidae Parapenaeopsis stylifera Egg,Penaeidae Parapenaeopsis stylifera 433,Parapenaeopsis stylifera Nauplius I L,0.27,Penaeidae,Parapenaeopsis,stylifera,0.27,C,Larvae,Invert,,,Parapenaeopsis stylifera Nauplius I,Penaeidae Parapenaeopsis stylifera Nauplius larvae,Penaeidae Parapenaeopsis stylifera 434,Parapenaeopsis stylifera Nauplius II L,0.27,Penaeidae,Parapenaeopsis,stylifera,0.27,C,Larvae,Invert,,,Parapenaeopsis stylifera Nauplius II,Penaeidae Parapenaeopsis stylifera Nauplius larvae,Penaeidae Parapenaeopsis stylifera 435,Parapenaeopsis stylifera Nauplius III L,0.275,Penaeidae,Parapenaeopsis,stylifera,0.275,C,Larvae,Invert,,,Parapenaeopsis stylifera Nauplius III,Penaeidae Parapenaeopsis stylifera Nauplius larvae,Penaeidae Parapenaeopsis stylifera 436,Parapenaeopsis stylifera Nauplius IV L,0.295,Penaeidae,Parapenaeopsis,stylifera,0.295,C,Larvae,Invert,,,Parapenaeopsis stylifera Nauplius IV,Penaeidae Parapenaeopsis stylifera Nauplius larvae,Penaeidae Parapenaeopsis stylifera 437,Parapenaeopsis stylifera Nauplius V L,0.305,Penaeidae,Parapenaeopsis,stylifera,0.305,C,Larvae,Invert,,,Parapenaeopsis stylifera Nauplius V,Penaeidae Parapenaeopsis stylifera Nauplius larvae,Penaeidae Parapenaeopsis stylifera 438,Parapenaeopsis stylifera Nauplius VI L,0.37,Penaeidae,Parapenaeopsis,stylifera,0.37,C,Larvae,Invert,,,Parapenaeopsis stylifera Nauplius VI,Penaeidae Parapenaeopsis stylifera Nauplius larvae,Penaeidae Parapenaeopsis stylifera 439,Parapenaeopsis stylifera Protozoea I L,0.63,Penaeidae,Parapenaeopsis,stylifera,0.63,C,Larvae,Invert,,,Parapenaeopsis stylifera Protozoea I,Penaeidae Parapenaeopsis stylifera Protozoea larvae,Penaeidae Parapenaeopsis stylifera 440,Parapenaeopsis stylifera Protozoea II L,1.13,Penaeidae,Parapenaeopsis,stylifera,1.13,C,Larvae,Invert,,,Parapenaeopsis stylifera Protozoea II,Penaeidae Parapenaeopsis stylifera Protozoea larvae,Penaeidae Parapenaeopsis stylifera 441,Parapenaeopsis stylifera Protozoea III L,1.575,Penaeidae,Parapenaeopsis,stylifera,1.575,C,Larvae,Invert,,,Parapenaeopsis stylifera Protozoea III,Penaeidae Parapenaeopsis stylifera Protozoea larvae,Penaeidae Parapenaeopsis stylifera 442,Parapenaeopsis stylifera Mysis I L,1.95,Penaeidae,Parapenaeopsis,stylifera,1.95,C,Larvae,Invert,,,Parapenaeopsis stylifera Mysis I,Penaeidae Parapenaeopsis stylifera Mysis larvae,Penaeidae Parapenaeopsis stylifera 443,Parapenaeopsis stylifera Mysis II L,2.245,Penaeidae,Parapenaeopsis,stylifera,2.245,C,Larvae,Invert,,,Parapenaeopsis stylifera Mysis II,Penaeidae Parapenaeopsis stylifera Mysis larvae,Penaeidae Parapenaeopsis stylifera 444,Parapenaeopsis stylifera Mysis III L,2.345,Penaeidae,Parapenaeopsis,stylifera,2.345,C,Larvae,Invert,,,Parapenaeopsis stylifera Mysis III,Penaeidae Parapenaeopsis stylifera Mysis larvae,Penaeidae Parapenaeopsis stylifera 445,Parapenaeopsis stylifera Mysis IV L,3.23,Penaeidae,Parapenaeopsis,stylifera,3.23,C,Larvae,Invert,,,Parapenaeopsis stylifera Mysis IV,Penaeidae Parapenaeopsis stylifera Mysis larvae,Penaeidae Parapenaeopsis stylifera 446,Parapenaeopsis stylifera Mysis V L,3.495,Penaeidae,Parapenaeopsis,stylifera,3.495,C,Larvae,Invert,,,Parapenaeopsis stylifera Mysis V,Penaeidae Parapenaeopsis stylifera Mysis larvae,Penaeidae Parapenaeopsis stylifera 447,Parapenaeopsis stylifera Mysis VI L,3.845,Penaeidae,Parapenaeopsis,stylifera,3.845,C,Larvae,Invert,,,Parapenaeopsis stylifera Mysis VI,Penaeidae Parapenaeopsis stylifera Mysis larvae,Penaeidae Parapenaeopsis stylifera 448,Parapenaeopsis stylifera Mysis VII L,3.885,Penaeidae,Parapenaeopsis,stylifera,3.885,C,Larvae,Invert,,,Parapenaeopsis stylifera Mysis VII,Penaeidae Parapenaeopsis stylifera Mysis larvae,Penaeidae Parapenaeopsis stylifera 449,Parapenaeopsis stylifera Postlarva I L,3.79,Penaeidae,Parapenaeopsis,stylifera,3.79,C,Larvae,Invert,,,Parapenaeopsis stylifera Postlarva I,Penaeidae Parapenaeopsis stylifera Postlarva larvae,Penaeidae Parapenaeopsis stylifera 450,Cirripedia Nauplius I L,0.26,Cirripedia,,,0.26,NC,Larvae,Invert,,,Cirripedia Nauplius I,Cirripedia Nauplius larvae,Cirripedia 451,Cirripedia Cypris stage L,0.405,Cirripedia,,,0.405,NC,Larvae,Invert,,,Cirripedia Cypris stage,Cirripedia Cypris stage larvae,Cirripedia 452,Cirripedia Nauplius II L,0.36,Cirripedia,,,0.36,NC,Larvae,Invert,,,Cirripedia Nauplius II,Cirripedia Nauplius larvae,Cirripedia 453,Cirripedia Nauplius III L,0.405,Cirripedia,,,0.405,NC,Larvae,Invert,,,Cirripedia Nauplius III,Cirripedia Nauplius larvae,Cirripedia 454,Cirripedia Nauplius IV L,0.4475,Cirripedia,,,0.4475,NC,Larvae,Invert,,,Cirripedia Nauplius IV,Cirripedia Nauplius larvae,Cirripedia 455,Cirripedia Nauplius V L,0.4775,Cirripedia,,,0.4775,NC,Larvae,Invert,,,Cirripedia Nauplius V,Cirripedia Nauplius larvae,Cirripedia 456,Cirripedia Nauplius VI L,0.565,Cirripedia,,,0.565,NC,Larvae,Invert,,,Cirripedia Nauplius VI,Cirripedia Nauplius larvae,Cirripedia 457,lsochrysis sp. A,0.0055,Isochrysidaceae,lsochrysis,,0.0055,NC,Adult,Auto,,,lsochrysis sp.,Isochrysidaceae lsochrysis sp. Adult,Isochrysidaceae lsochrysis sp. 458,salp A,55,Salpidae,salp,,55,NC,Adult,Chordate.Ecto,,,salp,Salpidae salp Adult,Salpidae salp459,Alexandrium minutum A,0.0225,Gonyaulacaceae,Alexandrium,minutum,0.0225,NC,Adult,Auto,,,Alexandrium minutum ,Gonyaulacaceae Alexandrium minutum Adult,Gonyaulacaceae Alexandrium minutum 460,Prorocentrum compressum A,0.04,Prorocentraceae,Prorocentrum,compressum,0.04,NC,Adult,Auto,,,Prorocentrum compressum,Prorocentraceae Prorocentrum compressum Adult,Prorocentraceae Prorocentrum compressum 461,Prorocentrum balticum A,0.019,Prorocentraceae,Prorocentrum,balticum,0.019,NC,Adult,Auto,,,Prorocentrum balticum,Prorocentraceae Prorocentrum balticum Adult,Prorocentraceae Prorocentrum balticum 462,Prorocentrum concavum A,0.0525,Prorocentraceae,Prorocentrum,concavum,0.0525,NC,Adult,Auto,,,Prorocentrum concavum ,Prorocentraceae Prorocentrum concavum Adult,Prorocentraceae Prorocentrum concavum 463,Prorocentrum dentatum A,0.04,Prorocentraceae,Prorocentrum,compressum,0.04,NC,Adult,Auto,,,Prorocentrum dentatum,Prorocentraceae Prorocentrum compressum Adult,Prorocentraceae Prorocentrum compressum 464,Prorocentrum emarginatum A,0.0375,Prorocentraceae,Prorocentrum,dentatum,0.0375,NC,Adult,Auto,,,Prorocentrum emarginatum ,Prorocentraceae Prorocentrum dentatum Adult,Prorocentraceae Prorocentrum dentatum 465,Prorocentrum lima A,0.04,Prorocentraceae,Prorocentrum,lima,0.04,NC,Adult,Auto,,,Prorocentrum lima,Prorocentraceae Prorocentrum lima Adult,Prorocentraceae Prorocentrum lima 466,Prorocentrum gracile A,0.05,Prorocentraceae,Prorocentrum,gracile,0.05,NC,Adult,Auto,,,Prorocentrum gracile,Prorocentraceae Prorocentrum  gracile Adult,Prorocentraceae Prorocentrum  gracile 467,Prorocentrum maculosum A,0.045,Prorocentraceae,Prorocentrum,maculosum,0.045,NC,Adult,Auto,,,Prorocentrum maculosum,Prorocentraceae Prorocentrum maculosum Adult,Prorocentraceae Prorocentrum maculosum468,Prorocentrum mexicanum A,0.034,Prorocentraceae,Prorocentrum,mexicanum,0.034,NC,Adult,Auto,,,Prorocentrum mexicanum,Prorocentraceae Prorocentrum mexicanum Adult,Prorocentraceae Prorocentrum mexicanum 469,Prorocentrum minimum A,0.01187,Prorocentraceae,Prorocentrum,minimum,0.01187,NC,Adult,Auto,,,Prorocentrum minimum,Prorocentraceae Prorocentrum minimum Adult,Prorocentraceae Prorocentrum minimum 470,Prorocentrum sigmoides A,0.05,Prorocentraceae,Prorocentrum,sigmoides,0.05,NC,Adult,Auto,,,Prorocentrum sigmoides ,Prorocentraceae Prorocentrum sigmoides Adult,Prorocentraceae Prorocentrum sigmoides 471,Prorocentrum triestinum A,0.02,Prorocentraceae,Prorocentrum,triestinum,0.02,NC,Adult,Auto,,,Prorocentrum triestinum,Prorocentraceae Prorocentrum triestinum Adult,Prorocentraceae Prorocentrum triestinum 472,Prorocentrum sp.1 A,0.04,Prorocentraceae,Prorocentrum,sp.1,0.04,NC,Adult,Auto,,,Prorocentrum sp. A ,Prorocentraceae Prorocentrum sp. A Adult,Prorocentraceae Prorocentrum sp. A 473,Ceratium horridum A,0.045,Ceratiaceae,Ceratium,horridum,0.045,NC,Adult,Auto,,,Ceratium horridum,Ceratiaceae Ceratium horridum Adult,Ceratiaceae Ceratium horridum 474,Ceratium macroceros A,0.35,Ceratiaceae,Ceratium,macroceros,0.35,NC,Adult,Auto,,,Ceratium macroceros,Ceratiaceae Ceratium macroceros Adult,Ceratiaceae Ceratium macroceros 477,Rhodomonas baltica A,0.00692,Pyrenomonadaceae,Rhodomonas,baltica,0.00692,NC,Adult,Auto,,,Rhodomonas baltica ,Pyrenomonadaceae Rhodomonas baltica Adult,Pyrenomonadaceae Rhodomonas baltica 478, Skeletonema sp. A,0.01,Skeletonemaceae,Skeletonema,,0.01,NC,Adult,Auto,,, Skeletonema sp.,Skeletonemaceae Skeletonema sp. Adult,Skeletonemaceae Skeletonema sp. 479, Platymonas subcordiformis A,0.01,Volvocaceae,Platymonas,subcordiformis,0.01,NC,Adult,Auto,,, Platymonas subcordiformis ,Volvocaceae Platymonas subcordiformis Adult,Volvocaceae Platymonas subcordiformis 480,Thalassiosira decipiens A,0.017,Thalassiosiraceae,Thalassiosira,decipiens,0.017,NC,Adult,Auto,,,Thalassiosira decipiens,Thalassiosiraceae Thalassiosira decipiens Adult,Thalassiosiraceae Thalassiosira decipiens 481,Phaeodactylum tricornutum A,0.01,Phaeodactylaceae,Phaeodactylum,tricornutum,0.01,NC,Adult,Auto,,,Phaeodactylum tricornutum,Phaeodactylaceae Phaeodactylum tricornutum Adult,Phaeodactylaceae Phaeodactylum tricornutum 482,Heterogloea sp. A,0.01,Heterogloeaceae,Heterogloea,,0.01,NC,Adult,Auto,,, Heterogloea sp .,Heterogloeaceae Heterogloea sp . Adult,Heterogloeaceae Heterogloea sp.483,Isochrysis galbana A,0.00456,Isochrysidaceae,Isochrysis,galbana,0.00456,NC,Adult,Auto,,, Isochrysis galbana , Isochrysidaceae Isochrysis galbana Adult, Isochrysidaceae Isochrysis galbana 484,Phaeodactylum A,0.01,Phaeodactylaceae,Phaeodactylum,,0.01,NC,Adult,Auto,,,Phaeodactylum ,Phaeodactylaceae Phaeodactylum Adult,Phaeodactylaceae Phaeodactylum485,Tricornutum A,0.01,Phaeodactylaceae,Tricornutum,,0.01,NC,Adult,Auto,,,Tricornutum ,Phaeodactylaceae Tricornutum Adult,Phaeodactylaceae Tricornutum 486,Chlorella sp. A,0.01,Chlorellaceae,Chlorella,,0.01,NC,Adult,Auto,,,Chlorella sp .,Chlorellaceae Chlorella sp . Adult,Chlorellaceae Chlorella sp.487,Corethron hystrix A,0.01,Corethraceae,Corethron,hystrix,0.01,NC,Adult,Auto,,,Corethron hystrix ,Corethraceae Corethron hystrix Adult,Corethraceae Corethron hystrix 488,Biddulphia sinensis A,0.01,Biddulphiaceae,Biddulphia,sinensis,0.01,NC,Adult,Auto,,,Biddulphia sinensis ,Biddulphiaceae Biddulphia sinensis Adult ,Biddulphiaceae Biddulphia sinensis489,Spirulina platensis A,0.01,Phormidiaceae,Spirulina,platensis,0.01,NC,Adult,Auto,,,Spirulina platensis ,Phormidiaceae Spirulina platensis Adult,Phormidiaceae Spirulina platensis492,Chaetoceros sp. A,0.0105,Chaetocerotaceae,Chaetoceros,,0.0105,NC,Adult,Auto,,,Chaetoceros sp.,Chaetocerotaceae Chaetoceros sp. Adult,Chaetocerotaceae Chaetoceros sp.493,Chaetoceros gracilis A,0.0105,Chaetocerotaceae,Chaetoceros,gracilis,0.0105,NC,Adult,Auto,,,Chaetoceros gracilis,Chaetocerotaceae Chaetoceros gracilis Adult,Chaetocerotaceae Chaetoceros gracilis494,Tetraselmis tetrathele A,0.0185,Chlorodendraceae,Tetraselmis,tetrathele,0.0185,NC,Adult,Auto,,,Tetraselmis tetrathele,Chlorodendraceae Tetraselmis tetrathele Adult,Chlorodendraceae Tetraselmis tetrathele495,Tetraselmis chuii A,0.0185,Chlorodendraceae,Tetraselmis,chuii,0.0185,NC,Adult,Auto,,,Tetraselmis chuii,Chlorodendraceae Tetraselmis chuii Adult,Chlorodendraceae Tetraselmis chuii496,Ligia exotica A,27,Ligiidae,Ligia,exotica,27,NC,Adult,Invert,,,Ligia exotica,Ligiidae Ligia exotica Adult,Ligiidae Ligia exotica497,Sphaeroma annandalei A,14,Sphaeromatidae,Sphaeroma,annandalei,14,NC,Adult,Invert,,,Sphaeroma annandalei,Sphaeromatidae Sphaeroma annandalei Adult,Sphaeromatidae Sphaeroma annandalei498,Tylos sp. nov. A,10,Tylidae,Tylos,,10,NC,Adult,Invert,,,Tylos sp. nov.,Tylidae Tylos sp. nov. Adult,Tylidae Tylos sp. nov.499,Cymodoce richardsonii A,13,Sphaeromatidae,Cymodoce,richardsonii,13,NC,Adult,Invert,,,Cymodoce richardsonii,Sphaeromatidae Cymodoce richardsonii Adult,Sphaeromatidae Cymodoce richardsonii500,Cymodoce sp. nov. A,14,Sphaeromatidae,Cymodoce,,14,NC,Adult,Invert,,,Cymodoce sp. nov.,Sphaeromatidae Cymodoce sp. nov. Adult,Sphaeromatidae Cymodoce sp. nov.501,Ostracods A,1.65,Ostracoda,Ostracods,,1.65,NC,Adult,Invert,,,Ostracods,Ostracoda Ostracods Adult,Ostracoda Ostracods502,Crustacean remains,0.1,Crustacean remains,,,0.1,NC,N/A,Invert,,,Crustacean remains,Crustacean remains,Crustacean remains505,Enteromorpha intestinalis A,1000,Ulvaceae,Enteromorpha,intestinalis,1000,NC,Adult,Auto,,,Enteromorpha intestinalis,Ulvaceae Enteromorpha intestinalis Adult,Ulvaceae Enteromorpha intestinalis506,Enteromorpha flexuosa A,200,Ulvaceae,Enteromorpha,flexuosa,200,NC,Adult,Auto,,,Enteromorpha flexuosa,Ulvaceae Enteromorpha flexuosa Adult,Ulvaceae Enteromorpha flexuosa507,Enteromorpha clathrata A,40,Ulvaceae,Enteromorpha,clathrata,40,NC,Adult,Auto,,,Enteromorpha clathrata,Ulvaceae Enteromorpha clathrata Adult,Ulvaceae Enteromorpha clathrata508,Enteromorpha compressa A,300,Ulvaceae,Enteromorpha,compressa,300,NC,Adult,Auto,,,Enteromorpha compressa,Ulvaceae Enteromorpha compressa Adult,Ulvaceae Enteromorpha compressa509,Ulva lactuca A,400,Ulvaceae,Ulva,lactuca,400,NC,Adult,Auto,,,Ulva lactuca,Ulvaceae Ulva lactuca Adult,Ulvaceae Ulva lactuca510,Cystoseira trinodis A,190,Sargassaceae,Cystoseira,trinodis,190,NC,Adult,Auto,,,Cystoseira trinodis,Sargassaceae Cystoseira trinodis Adult,Sargassaceae Cystoseira trinodis511,Cystoseira myrica A,200,Sargassaceae,Cystoseira,myrica,200,NC,Adult,Auto,,,Cystoseira myrica,Sargassaceae Cystoseira myrica Adult,Sargassaceae Cystoseira myrica 512,Dictyota divaricata A,60,Dictyotaceae,Dictyota,divaricata,60,NC,Adult,Auto,,,Dictyota divaricata,Dictyotaceae Dictyota divaricata Adult,Dictyotaceae Dictyota divaricata 513,Dictyota indica A,200,Dictyotaceae,Dictyota,indica,200,NC,Adult,Auto,,,Dictyota indica,Dictyotaceae Dictyota indica Adult,Dictyotaceae Dictyota indica 514,Halichondria cf. glabrata A,300,Halichondriidae,Halichondria,glabrata,300,NC,Adult,Auto,,,Halichondria cf. glabrata ,Halichondriidae Halichondria cf. glabrata Adult,Halichondriidae Halichondria cf. glabrata515,Tethya cf. aurantium A,100,Tethyidae,Tethya,aurantium,100,NC,Adult,Auto,,,Tethya cf. aurantium,Tethyidae Tethya cf. aurantium Adult,Tethyidae Tethya cf. aurantium 516,Cliona vastifera A,65,Clionaidae,Cliona,vastifera,65,NC,Adult,Auto,,,Cliona vastifera ,Clionaidae Cliona vastifera Adult,Clionaidae Cliona vastifera 517,Gellius cf. fibulatus A,200,Chalinidae,Gellius,fibulatus,200,NC,Adult,Auto,,,Gellius cf. fibulatus,Chalinidae Gellius cf. fibulatus Adult,Chalinidae Gellius cf. fibulatus 518,Haliclona sp. A,300,Chalinidae,Haliclona,,300,NC,Adult,Auto,,,Haliclona sp.,Chalinidae Haliclona sp. Adult,Chalinidae Haliclona sp. 519,Terpios sp. A,2,Suberitidae,Terpios,,2,NC,Adult,Auto,,,Terpios sp.,Suberitidae Terpios sp. Adult,Suberitidae Terpios sp. 520,Tedania anhelans A,150,Tedaniidae,Tedania,anhelans,150,NC,Adult,Auto,,,Tedania anhelans,Tedaniidae Tedania anhelans Adult,Tedaniidae Tedania anhelans 521,Phormidium corium A,0.00375,Phormidiaceae,Phormidium,corium,0.00375,NC,Adult,Bact,,,Phormidium corium,Phormidiaceae Phormidium corium Adult,Phormidiaceae Phormidium corium 522,Lyngbya epiphytica A,0.0015,Phormidiaceae,Lyngbya,epiphytica,0.0015,NC,Adult,Bact,,,Lyngbya epiphytica,Phormidiaceae Lyngbya epiphytica Adult,Phormidiaceae Lyngbya epiphytica 523,Microcoleus chthonoplastes A,0.00375,Phormidiaceae,Microcoleus,chthonoplastes,0.00375,NC,Adult,Bact,,,Microcoleus chthonoplastes,Phormidiaceae Microcoleus chthonoplastes Adult,Phormidiaceae Microcoleus chthonoplastes 524,Oscillatoria nigro-viridis A,0.00335,Oscillatoriaceae,Oscillatoria,nigro-viridis,0.00335,NC,Adult,Bact,,,Oscillatoria nigro-viridis,Oscillatoriaceae Oscillatoria nigro-viridis Adult,Oscillatoriaceae Oscillatoria nigro-viridis 525,Chroococcus membraninus A,0.0045,Chroococcaceae,Chroococcus,membraninus,0.0045,NC,Adult,Bact,,,Chroococcus membraninus,Chroococcaceae Chroococcus membraninus Adult,Chroococcaceae Chroococcus membraninus 526,Chroococcus varius A2,0.0085,Chroococcaceae,Chroococcus,varius,0.0085,NC,Adult,Bact,,,Chroococcus varius1,Chroococcaceae Chroococcus varius1 Adult,Chroococcaceae Chroococcus varius1 527,Chroococcus varius A1,0.0035,Chroococcaceae,Chroococcus,varius,0.0035,NC,Adult,Bact,,,Chroococcus varius2,Chroococcaceae Chroococcus varius2 Adult,Chroococcaceae Chroococcus varius2 528,Lyngbya ceylanica A,0.00725,Phormidiaceae,Lyngbya,ceylanica,0.00725,NC,Adult,Bact,,,Lyngbya ceylanica,Phormidiaceae Lyngbya ceylanica Adult,Phormidiaceae Lyngbya ceylanica 529,Lyngbya majuscula A,50,Phormidiaceae,Lyngbya,majuscula,50,NC,Adult,Bact,,,Lyngbya majuscula,Phormidiaceae Lyngbya majuscula Adult,Phormidiaceae Lyngbya majuscula 530,Oscillatoria princeps A,0.032,Chroococcaceae,Oscillatoria,princeps,0.032,NC,Adult,Bact,,,Oscillatoria princeps,Chroococcaceae Oscillatoria princeps Adult,Chroococcaceae Oscillatoria princeps 531,Calothrix confervicola A,25,Rivulariaceae,Calothrix,confervicola,25,NC,Adult,Auto,,,Calothrix confervicola ,Rivulariaceae Calothrix confervicola Adult,Rivulariaceae Calothrix confervicola 532,Synechocystis marina A,0.0005,Merismopediaceae,Synechocystis,marina,0.0005,NC,Adult,Auto,,,Synechocystis marina ,Merismopediaceae Synechocystis marina Adult,Merismopediaceae Synechocystis marina 533,Tetraselmis gracilis A,0.0185,Chlorodendraceae,Tetraselmis,gracilis,0.0185,NC,Adult,Auto,,,Tetraselmis gracilis,Chlorodendraceae Tetraselmis gracilis Adult,Chlorodendraceae Tetraselmis gracilis 534,Sparidae larvae L1,8,Sparidae,,,8,C,Larvae,Vert.Ecto,,,Sparidae larvae (small),Sparidae larvae ,Sparidae535,Sparidae larvae L2,15.5,Sparidae,,,15.5,C,Larvae,Vert.Ecto,,,Sparidae larvae (medium),Sparidae larvae ,Sparidae536,Sparidae larvae L3,25.5,Sparidae,,,25.5,C,Larvae,Vert.Ecto,,,Sparidae larvae (large),Sparidae larvae ,Sparidae537,Sparidae J,41.25,Sparidae,,,41.25,C,Juvenile,Vert.Ecto,,,Sparidae (early juvenile),Sparidae Juvenile,Sparidae538,Serranidae larvae L2,3.65,Serranidae,,,3.65,C,Larvae,Vert.Ecto,,,Serranidae larvae (small),Serranidae larvae ,Serranidae 539,Serranidae larvae L3,7.6,Serranidae,,,7.6,C,Larvae,Vert.Ecto,,,Serranidae larvae (large),Serranidae larvae ,Serranidae 540,Serranidae J,66.75,Serranidae,,,66.75,C,Juvenile,Vert.Ecto,,,Serranidae (juvenile),Serranidae Juvenile,Serranidae 541,Stromateidae L1,2.56,Stromateidae,,,2.56,C,Larvae,Vert.Ecto,,,Stromateidae larvae (small),Stromateidae larvae,Stromateidae542,Stromateidae L2,3.61,Stromateidae,,,3.61,C,Larvae,Vert.Ecto,,,Stromateidae larvae (medium),Stromateidae larvae,Stromateidae543,Stromateidae L3,5.575,Stromateidae,,,5.575,C,Larvae,Vert.Ecto,,,Stromateidae larvae (large),Stromateidae larvae ,Stromateidae544,Stromateidae larvae (postlarvae) L4,13.5,Stromateidae,,,13.5,C,Larvae,Vert.Ecto,,,Stromateidae larvae (postlarvae),Stromateidae larvae ,Stromateidae545,Stromateidae J1,28.93,Stromateidae,,,28.93,C,Juvenile,Vert.Ecto,,,Stromateidae (early juvenile),Stromateidae Juvenile,Stromateidae546,Stromateidae J2,78.5,Stromateidae,,,78.5,C,Juvenile,Vert.Ecto,,,Stromateidae (large juvenile),Stromateidae Juvenile,Stromateidae547,copepod nauplii L2,0.075,Copepoda,,,0.075,NC,Larvae,Invert,,,copepod nauplii-1,Copepoda copepod nauplii larvae,Copepoda 548,copepod nauplii L1,0.04,Copepoda,,,0.04,NC,Larvae,Invert,,,copepod nauplii-2,Copepoda copepod nauplii larvae,Copepoda 549,Acartia nauplii (NI) L,0.116,Acartiidae,Acartia ,,0.116,NC,Larvae,Invert,,,Acartia nauplii (NI),Acartiidae Acartia nauplii larvae,Acartiidae Acartia550,Acartia nauplii (NII) L,0.135,Acartiidae,Acartia,,0.135,NC,Larvae,Invert,,,Acartia nauplii (NII),Acartiidae Acartia nauplii larvae,Acartiidae Acartia551,Acartia nauplii (NIII) L,0.195,Acartiidae,Acartia,,0.195,NC,Larvae,Invert,,,Acartia nauplii (NIII),Acartiidae Acartia nauplii larvae,Acartiidae Acartia552,Acartia nauplii (NIV) L,0.158,Acartiidae,Acartia,,0.158,NC,Larvae,Invert,,,Acartia nauplii (NIV),Acartiidae Acartia nauplii larvae,Acartiidae Acartia553,Acartia E,0.075,Acartiidae,Acartia,,0.075,NC,Egg,Invert,,,Acartia eggs,Acartiidae Acartia eggs,Acartiidae Acartia554,Sargassum angustifolium A,200,Sargassaceae,Sargassum,angustifolium,200,NC,Adult,Auto,,,Sargassum angustifolium,Sargassaceae Sargassum angustifolium Adult,Sargassaceae Sargassum angustifolium 555,Sargassum binderi A,400,Sargassaceae,Sargassum,binderi,400,NC,Adult,Auto,,,Sargassum binderi,Sargassaceae Sargassum binderi Adult,Sargassaceae Sargassum binderi 556,Sargassum boveanum A,450,Sargassaceae,Sargassum,boveanum,450,NC,Adult,Auto,,,Sargassum boveanum,Sargassaceae Sargassum boveanum Adult,Sargassaceae Sargassum boveanum 557,Sargassum boveanum var. aterrimum A,300,Sargassaceae,Sargassum,boveanum var. aterrimum,300,NC,Adult,Auto,,,Sargassum boveanum var. aterrimum,Sargassaceae Sargassum boveanum var. aterrimum Adult,Sargassaceae Sargassum boveanum var. aterrimum 558,Fish remains,0.1,Fish remains,,,0.1,NC,N/A,Vert.Ecto,,,Fish remains,Fish remains,Fish remains559,Coscinodiscus centralis A,0.265,Coscinodiscaceae,Coscinodiscus,centralis,0.265,NC,Adult,Auto,,,Coscinodiscus centralis ,Coscinodiscaceae Coscinodiscus centralis Adult,Coscinodiscaceae Coscinodiscus centralis 560, Pleurosigma normani A,0.345,Pleurosigmataceae,Pleurosigma,normani,0.345,NC,Adult,Auto,,, Pleurosigma normani,Pleurosigmataceae Pleurosigma normani Adult,Pleurosigmataceae Pleurosigma normani 561,Thallosiothrix frauenfeldii A,0.07,Thalassionemataceae,Thallosiothrix,frauenfeldii,0.07,NC,Adult,Auto,,,Thallosiothrix frauenfeldii,Thalassionemataceae Thallosiothrix frauenfeldii Adult,Thalassionemataceae Thallosiothrix frauenfeldii 562,Pampus argenteus J1,115.5,Stromateidae,Pampus,argenteus,115.5,C,Juvenile,Vert.Ecto,,,Pampus argenteus (average size=115.5mm),Stromateidae Pampus argenteus Juvenile,Pampus argenteus563,Pampus argenteus A1,165.5,Stromateidae,Pampus,argenteus,165.5,C,Adult,Vert.Ecto,,,Pampus argenteus (average size=165.5mm),Stromateidae Pampus argenteus Adult,Pampus argenteus564,Pampus argenteus A4,215.5,Stromateidae,Pampus,argenteus,215.5,C,Adult,Vert.Ecto,,,Pampus argenteus (average size=215.5mm),Stromateidae Pampus argenteus Adult,Pampus argenteus565,Pampus argenteus A6,265.5,Stromateidae,Pampus,argenteus,265.5,C,Adult,Vert.Ecto,,,Pampus argenteus (average size=265.5mm),Stromateidae Pampus argenteus Adult,Pampus argenteus566,Platycephalidae L1,3.5,Platycephalidae,,,3.5,C,Larvae,Vert.Ecto,,,Platycephalidae larvae (a),Platycephalidae larvae,Platycephalidae 568,Platycephalidae L3,5.8,Platycephalidae,,,5.8,C,Larvae,Vert.Ecto,,,Platycephalidae larvae (b),Platycephalidae larvae,Platycephalidae 569,Scianidae  L3,4.6,Scianidae,,,4.6,C,Larvae,Vert.Ecto,,,Scianidae larvae (a),Scianidae larvae ,Scianidae 570,Scianidae L4,5.75,Scianidae,,,5.75,C,Larvae,Vert.Ecto,,,Scianidae larvae (b),Scianidae larvae ,Scianidae 571,Scianidae L2,3.75,Scianidae,,,3.75,C,Larvae,Vert.Ecto,,,Scianidae larvae (c),Scianidae larvae ,Scianidae 572,Scianidae L1,2,Scianidae,,,2,C,Larvae,Vert.Ecto,,,Scianidae larvae (d),Scianidae larvae ,Scianidae 573,Scianidae L5,7.9,Scianidae,,,7.9,C,Larvae,Vert.Ecto,,,Scianidae larvae (1),Scianidae larvae ,Scianidae 1063,Scianidae L6,11.5,Scianidae,,,11.5,C,Larvae,Vert.Ecto,,,Scianidae larvae (2),Scianidae larvae ,Scianidae 1064,Scianidae L7,22.5,Scianidae,,,22.5,C,Larvae,Vert.Ecto,,,Scianidae larvae (3),Scianidae larvae ,Scianidae 1065,Scianidae J1,37.5,Scianidae,,,37.5,C,Juvenile,Vert.Ecto,,,Scianidae larvae (4),Scianidae Juvenile,Scianidae 1066,Scianidae J2,52.5,Scianidae,,,52.5,C,Juvenile,Vert.Ecto,,,Scianidae larvae (5),Scianidae Juvenile,Scianidae 1067,Scianidae J3,67.5,Scianidae,,,67.5,C,Juvenile,Vert.Ecto,,,Scianidae larvae (6),Scianidae Juvenile,Scianidae 1068,Scianidae J4,82.5,Scianidae,,,82.5,C,Juvenile,Vert.Ecto,,,Scianidae larvae (7),Scianidae Juvenile,Scianidae 1069,Scianidae J5,97.5,Scianidae,,,97.5,C,Juvenile,Vert.Ecto,,,Scianidae larvae (8),Scianidae Juvenile,Scianidae 1070,Scianidae J6,112.5,Scianidae,,,112.5,C,Juvenile,Vert.Ecto,,,Scianidae larvae (9),Scianidae Juvenile,Scianidae 1071,Scianidae J7,121,Scianidae,,,121,C,Juvenile,Vert.Ecto,,,Scianidae larvae (10),Scianidae Juvenile,Scianidae 1072,Thryssa setirostris J,19.9,Engraulidae,Thryssa,setirostris,19.9,NC,Juvenile,Vert.Ecto,,,Thryssa setirostris (larvae-juveniles),Engraulidae Thryssa setirostris (larvae-juveniles) Juvenile,Engraulidae Thryssa setirostris574,Thryssa hamiltonii J,13.7,Engraulidae,Thryssa,hamiltonii,13.7,NC,Juvenile,Vert.Ecto,,,Thryssa hamiltonii (larvae-juveniles),Engraulidae Thryssa hamiltonii (larvae-juveniles) Juvenile,Engraulidae Thryssa hamiltonii 575,Synodontidae (Trachinocephalus mypos) L,2.13,Synodontidae,Trachinocephalus,mypos,2.13,NC,Larvae,Vert.Ecto,,,Synodontidae larvae (Trachinocephalus mypos),Synodontidae (Trachinocephalus mypos) larvae,Synodontidae (Trachinocephalus mypos) 576,Synodontidae L,9.5,Synodontidae,,,9.5,NC,Larvae,Vert.Ecto,,,Synodontidae larvae,Synodontidae larvae,Synodontidae