577,Mugilidae L2,22.5,Mugilidae,,,22.5,C,Larvae,Vert.Ecto,,,Mugilidae larvae (a),Mugilidae larvae ,Mugilidae578,Mugilidae L3,27.5,Mugilidae,,,27.5,C,Larvae,Vert.Ecto,,,Mugilidae larvae (b),Mugilidae larvae ,Mugilidae579,Mugilidae L4,35.5,Mugilidae,,,35.5,C,Larvae,Vert.Ecto,,,Mugilidae larvae (c),Mugilidae larvae ,Mugilidae1073,Mugilidae L5,37.5,Mugilidae,,,37.5,C,Larvae,Vert.Ecto,,,Mugilidae larvae (d),Mugilidae larvae ,Mugilidae1074,Mugilidae L6,45,Mugilidae,,,45,C,Larvae,Vert.Ecto,,,Mugilidae larvae (e),Mugilidae larvae ,Mugilidae1075,Mugilidae L7,60,Mugilidae,,,60,C,Larvae,Vert.Ecto,,,Mugilidae larvae (f),Mugilidae larvae ,Mugilidae1076,Mugilidae L1,5.65,Mugilidae,,,5.65,C,Larvae,Vert.Ecto,,,Mugilidae larvae (g),Mugilidae larvae ,Mugilidae1077,Leiognathus bindus A1,93.5,Leiognathidae,Leiognathus,bindus,93.5,NC,Adult,Vert.Ecto,,,Leiognathus bindus 1,Leiognathidae Leiognathus bindus Adult,Leiognathidae Leiognathus bindus 580,Leiognathus bindus A2,105.5,Leiognathidae,Leiognathus,bindus,105.5,NC,Adult,Vert.Ecto,,,Leiognathus bindus 2,Leiognathidae Leiognathus bindus Adult,Leiognathidae Leiognathus bindus 581,Leiognathidae L3,2.7,Leiognathidae,,,2.7,NC,Larvae,Vert.Ecto,,,Leiognathidae larvae 1,Leiognathidae larvae ,Leiognathidae  582,Leiognathidae L6,4.1,Leiognathidae,,,4.1,NC,Larvae,Vert.Ecto,,,Leiognathidae larvae 2,Leiognathidae larvae ,Leiognathidae  583,Leiognathidae L7,7.6,Leiognathidae,,,7.6,NC,Larvae,Vert.Ecto,,,Leiognathidae larvae 3,Leiognathidae larvae ,Leiognathidae  584,Leiognathidae L1,1.9,Leiognathidae,,,1.9,NC,Larvae,Vert.Ecto,,,Leiognathidae larvae 4,Leiognathidae larvae ,Leiognathidae  585,Leiognathidae L2,2.6,Leiognathidae,,,2.6,NC,Larvae,Vert.Ecto,,,Leiognathidae larvae 5,Leiognathidae larvae ,Leiognathidae  586,Leiognathidae L4,3,Leiognathidae,,,3,NC,Larvae,Vert.Ecto,,,Leiognathidae larvae 6,Leiognathidae larvae ,Leiognathidae  587,Leiognathidae L5,3.5,Leiognathidae,,,3.5,NC,Larvae,Vert.Ecto,,,Leiognathidae larvae 7,Leiognathidae larvae ,Leiognathidae  588,Penaeus semisulcateus J1,33,Penaeidae,Penaeus,semisulcateus,33,C,Juvenile,Invert,,,Penaeus semisulcateus (33mm),Penaeidae Penaeus semisulcateus Juvenile,Penaeidae Penaeus semisulcateus 589,Metapenaeus affinis J1,33,Penaeidae,Metapenaeus,affinis,33,C,Juvenile,Invert,,,Metapenaeus affinis (33mm),Penaeidae Metapenaeus affinis Juvenile,Penaeidae Metapenaeus affinis590,Parapenaeopsis stylifera J1,33,Penaeidae,Parapenaeopsis,stylifera,33,C,Juvenile,Invert,,,Parapenaeopsis stylifera (33mm),Penaeidae Parapenaeopsis stylifera Juvenile,Penaeidae Parapenaeopsis stylifera 591,Johnius dussumieri A2,191.5,Scianidae,Johnius,dussumieri,191.5,NC,Adult,Vert.Ecto,,,Johnius dussumieri (191.5mm),Scianidae Johnius dussumieri Adult,Scianidae Johnius dussumieri 592,Platycephalus indicus A2,380,Platycephalidae,Platycephalus,indicus,380,C,Adult,Vert.Ecto,,,Platycephalus indicus,Platycephalidae Platycephalus indicus Adult ,Platycephalidae Platycephalus indicus 593,Gonodactylus demani demani A,30,Gonodactylidae,Gonodactylus,demani demani,30,NC,Adult,Invert,,,Gonodactylus demani demani,Gonodactylidae Gonodactylus demani demani Adult,Gonodactylidae Gonodactylus demani demani 594,Heterocuma andamani A,7.5,Bodotriidae,Heterocuma,andamani,7.5,NC,Adult,Invert,,,Heterocuma andamani,Bodotriidae Heterocuma andamani Adult,Bodotriidae Heterocuma andamani 595,Cyclaspis picta A,5,Bodotriidae,Cyclaspis,picta,5,NC,Adult,Invert,,,Cyclaspis picta,Bodotriidae Cyclaspis picta Adult,Bodotriidae Cyclaspis picta 596,Eocuma affine A,7,Bodotriidae,Eocuma,affine,7,NC,Adult,Invert,,,Eocuma affine ,Bodotriidae Eocuma affine Adult,Bodotriidae Eocuma affine 597,Rhopalophthalmus sp. A,15,Mysidae,Rhopalophthalmus,,15,NC,Adult,Invert,,,Rhopalophthalmus sp.,Mysidae Rhopalophthalmus sp. Adult,Mysidae Rhopalophthalmus sp. 598,Gastrosaccus kempi A,10,Mysidae,Gastrosaccus,kempi,10,NC,Adult,Invert,,,Gastrosaccus kempi,Mysidae Gastrosaccus kempi Adult,Mysidae Gastrosaccus kempi 599,Macrophytal detritus A,1,Macrophytal detritus,,,1,NC,N/A,NA,,,Macrophytal detritus,Macrophytal detritus,Macrophytal detritus600,juvenile mysids (based on Mesopodopsis slabberi) J,1.235,Mysidae,Mesopodopsis,slabberi,1.235,NC,Juvenile,Invert,,,juvenile mysids (based on Mesopodopsis slabberi),Mysidae juvenile mysids (based on Mesopodopsis slabberi) Juvenile,Mysidae mysids (based on Mesopodopsis slabberi) 601,Otilithes cuvieri J,120.5,Scianidae,Otilithes,cuvieri,120.5,C,Juvenile,Vert.Ecto,,,Otilithes cuvieri 1,Scianidae Otilithes cuvieri Juvenile,Scianidae Otilithes cuvieri 602,Otilithes cuvieri A1,180.5,Scianidae,Otilithes,cuvieri,180.5,C,Adult,Vert.Ecto,,,Otilithes cuvieri 2,Scianidae Otilithes cuvieri Adult,Scianidae Otilithes cuvieri 603,Otilithes cuvieri A2,240.5,Scianidae,Otilithes,cuvieri,240.5,C,Adult,Vert.Ecto,,,Otilithes cuvieri 3,Scianidae Otilithes cuvieri Adult,Scianidae Otilithes cuvieri 604,Nannochloris sp. A,0.00169,Chlorellaceae,Nannochloris,,0.00169,NC,Adult,Auto,,,Nannochloris sp.,Chlorellaceae Nannochloris sp. Adult,Chlorellaceae Nannochloris sp. 605,Pavlova lutherii A,0.00378,Pavlovaceae,Pavlova,lutherii,0.00378,NC,Adult,Auto,,,Pavlova lutherii,Pavlovaceae Pavlova lutherii Adult,Pavlovaceae Pavlova lutherii 606,Pyramimonas sp. A,0.00561,Pyramimonadaceae,Pyramimonas,,0.00561,NC,Adult,Auto,,,Pyramimonas sp.,Pyramimonadaceae Pyramimonas sp. Adult,Pyramimonadaceae Pyramimonas sp. 607,Dunaliella tertiolecta A,0.00633,Dunaliellaceae,Dunaliella,tertiolecta,0.00633,NC,Adult,Auto,,,Dunaliella tertiolecta,Dunaliellaceae Dunaliella tertiolecta Adult,Dunaliellaceae Dunaliella tertiolecta 608,Tetraselmis suecica A,0.0085,Chlorodendraceae,Tetraselmis,suecica,0.0085,NC,Adult,Auto,,,Tetraselmis suecica,Chlorodendraceae Tetraselmis suecica Adult,Chlorodendraceae Tetraselmis suecica609,Heterocapsa triquetra A,0.01431,Peridiniida,Heterocapsa,triquetra,0.01431,NC,Adult,Auto,,,Heterocapsa triquetra,Peridiniida incertae sedis Heterocapsa triquetra Adult,Peridiniida incertae sedis Heterocapsa triquetra 610,Chaetoceros calcitrans A,0.00425,Chaetocerotaceae,Chaetoceros,calcitrans,0.00425,NC,Adult,Auto,,,Chaetoceros calcitrans,Chaetocerotaceae Chaetoceros calcitrans Adult,Chaetocerotaceae Chaetoceros calcitrans 611,Sardinella fimbriata A,150,Clupeidae,Sardinella,fimbriata,150,NC,Adult,Vert.Ecto,,,Sardinella fimbriata,Clupeidae Sardinella fimbriata Adult,Clupeidae Sardinella fimbriata 612,Sardinella (Sardinella) longiceps A,115,Clupeidae,Sardinella (Sardinella),longiceps,115,NC,Adult,Vert.Ecto,,,Sardinella (Sardinella) longiceps,Clupeidae Sardinella (Sardinella) longiceps Adult,Clupeidae Sardinella (Sardinella) longiceps 613,Sardinella (Clupeonia) jussieui = Clupeonia jussieui A,114,Clupeidae,Sardinella (Clupeonia),jussieui,114,NC,Adult,Vert.Ecto,,,Sardinella (Clupeonia) jussieui = Clupeonia jussieui,Clupeidae Sardinella (Clupeonia) jussieui = Clupeonia jussieui Adult,Clupeidae Sardinella (Clupeonia) jussieui = Clupeonia jussieui 614,Sardinella (Clupeonia) sindensis= Clupeonia sindensis A,92,Clupeidae,Sardinella (Clupeonia),sindensis,92,NC,Adult,Vert.Ecto,,,Sardinella (Clupeonia) sindensis= Clupeonia sindensis,Clupeidae Sardinella (Clupeonia) sindensis= Clupeonia sindensis Adult,Clupeidae Sardinella (Clupeonia) sindensis= Clupeonia sindensis 615,Sardinella (Clupeonia) perforata= Clupeonia perforata A,85.5,Clupeidae,Sardinella (Clupeonia),perforata,85.5,NC,Adult,Vert.Ecto,,,Sardinella (Clupeonia) perforata= Clupeonia perforata,Clupeidae Sardinella (Clupeonia) perforata= Clupeonia perforata Adult,Clupeidae Sardinella (Clupeonia) perforata= Clupeonia perforata 616,Sardinella zunasi L2,18.4,Clupeidae,Sardinella,zunasi,18.4,NC,Larvae,Vert.Ecto,,,Sardinella zunasi larvae 1,Clupeidae Sardinella zunasi larvae ,Clupeidae Sardinella zunasi 617,Sardinella zunasi larvae L1,9.9,Clupeidae,Sardinella,zunasi,9.9,NC,Larvae,Vert.Ecto,,,Sardinella zunasi larvae 2,Clupeidae Sardinella zunasi larvae ,Clupeidae Sardinella zunasi 618,Sardinella sp. L5,14.15,Clupeidae,Sardinella,,14.15,NC,Larvae,Vert.Ecto,,,Sardinella sp. larvae,Clupeidae Sardinella sp. larvae,Clupeidae Sardinella sp. 620,Bathygobius fuscus A,120,Gobiidae,Bathygobius,fuscus,120,NC,Adult,Vert.Ecto,,,Bathygobius fuscus ,Gobiidae Bathygobius fuscus Adult,Gobiidae Bathygobius fuscus 622,Scartelaos (viridis) histophorus A,180,Gobiidae,Scartelaos (viridis),histophorus,180,NC,Adult,Vert.Ecto,,,Scartelaos (viridis) histophorus ,Gobiidae Scartelaos (viridis) histophorus Adult,Gobiidae Scartelaos (viridis) histophorus 623,Boleophthalmus boddarti A,360,Gobiidae,Boleophthalmus,boddarti,360,NC,Adult,Vert.Ecto,,,Boleophthalmus boddarti ,Gobiidae Boleophthalmus boddarti Adult,Gobiidae Boleophthalmus boddarti 624,Periophthalmus koelreuteri = P. waltoni A,150,Gobiidae,Periophthalmus,koelreuteri (waltoni),150,NC,Adult,Vert.Ecto,,,Periophthalmus koelreuteri = P. waltoni,Gobiidae Periophthalmus koelreuteri = P. waltoni Adult,Gobiidae Periophthalmus koelreuteri = P. waltoni 625,Apocryptes madurensis A,50,Gobiidae,Apocryptes,madurensis,50,NC,Adult,Vert.Ecto,,,Apocryptes madurensis,Gobiidae Apocryptes madurensis Adult,Gobiidae Apocryptes madurensis 626,Gobius brevirostris A,70,Gobiidae,Gobius,brevirostris,70,NC,Adult,Vert.Ecto,,,Gobius brevirostris,Gobiidae Gobius brevirostris Adult,Gobiidae Gobius brevirostris 627,Istigobius (Acentrogobius) ornatus A,90,Gobiidae,Istigobius (Acentrogobius),ornatus,90,NC,Adult,Vert.Ecto,,,Istigobius (Acentrogobius) ornatus,Gobiidae Istigobius (Acentrogobius) ornatus Adult,Gobiidae Istigobius (Acentrogobius) ornatus 628,Istigobius (Acentrogobius) cyanomos A,60,Gobiidae,Istigobius (Acentrogobius),cyanomos,60,NC,Adult,Vert.Ecto,,,Istigobius (Acentrogobius) cyanomos,Gobiidae Istigobius (Acentrogobius) cyanomos Adult,Gobiidae Istigobius (Acentrogobius) cyanomos 629,Tenualosa ilisha A,298,Clupeidae,Tenualosa,ilisha,298,C,Adult,Vert.Ecto,,,Tenualosa ilisha ,Clupeidae Tenualosa ilisha Adult,Clupeidae Tenualosa ilisha 630,Ilisha elongata A,247,Clupeidae,Ilisha,elongata,247,C,Adult,Vert.Ecto,,,Ilisha elongata,Clupeidae Ilisha elongata Adult,Clupeidae Ilisha elongata 631,Nematalosa (Dorosoma) nasus A,220,Clupeidae,Nematalosa (Dorosoma),nasus,220,NC,Adult,Vert.Ecto,,,Nematalosa (Dorosoma) nasus ,Clupeidae Nematalosa (Dorosoma) nasus Adult,Clupeidae Nematalosa (Dorosoma) nasus 632,Lepidotrigla omanensis A,94,Triglidae,Lepidotrigla,omanensis,94,NC,Adult,Vert.Ecto,,,Lepidotrigla omanensis,Triglidae Lepidotrigla omanensis Adult,Triglidae Lepidotrigla omanensis 633,Lepidotrigla sp. A,79,Triglidae,Lepidotrigla,,79,NC,Adult,Vert.Ecto,,,Lepidotrigla sp.,Triglidae Lepidotrigla sp. Adult,Triglidae Lepidotrigla sp. 634,Callionymus filamentousus A,118,Callionymidae,Callionymus,filamentousus,118,NC,Adult,Vert.Ecto,,,Callionymus filamentousus ,Callionymidae Callionymus filamentousus Adult,Callionymidae Callionymus filamentousus 636,Synaptura orientalis A,173,Soleidae,Synaptura,orientalis,173,C,Adult,Vert.Ecto,,,Synaptura orientalis,Soleidae Synaptura orientalis Adult,Soleidae Synaptura orientalis 637,Benthosema (pterota) pterotum A,70,Myctophidae,Benthosema (pterota),pterotum,70,NC,Adult,Vert.Ecto,,,Benthosema (pterota) pterotum ,Myctophidae Benthosema (pterota) pterotum Adult,Myctophidae Benthosema (pterota) pterotum 638,Notolychnus valdiviae A,63,Myctophidae,Notolychnus,valdiviae,63,NC,Adult,Vert.Ecto,,,Notolychnus valdiviae ,Myctophidae Notolychnus valdiviae Adult,Myctophidae Notolychnus valdiviae 641,Thryssa mystax A,130,Engraulidae,Thryssa,mystax,130,NC,Adult,Vert.Ecto,,,Thryssa mystax (130mm),Engraulidae Thryssa mystax Adult,Engraulidae Thryssa mystax 642,Thryssa mystax J,53.5,Engraulidae,Thryssa,mystax,53.5,NC,Juvenile,Vert.Ecto,,,Thryssa mystax (53.5mm),Engraulidae Thryssa mystax Juvenile,Engraulidae Thryssa mystax 643,Pentaprion longimanus J2,68.5,Gerreidae,Pentaprion,longimanus,68.5,NC,Juvenile,Vert.Ecto,,,Pentaprion longimanus 1,Gerreidae Pentaprion longimanus Juvenile,Gerreidae Pentaprion longimanus 647,Pentaprion longimanus J1,65,Gerreidae,Pentaprion,longimanus,65,NC,Juvenile,Vert.Ecto,,,Pentaprion longimanus 2,Gerreidae Pentaprion longimanus Juvenile,Gerreidae Pentaprion longimanus 648,Gerres filamentosus J1,73,Gerreidae,Gerres,filamentosus,73,NC,Juvenile,Vert.Ecto,,,Gerres filamentosus 1,Gerreidae Gerres filamentosus Juvenile,Gerreidae Gerres filamentosus 649,Gerres filamentosus J2,74.5,Gerreidae,Gerres,filamentosus,74.5,NC,Juvenile,Vert.Ecto,,,Gerres filamentosus 2,Gerreidae Gerres filamentosus Juvenile,Gerreidae Gerres filamentosus 650,Anodontostoma chacunda A2,220,Clupeidae,Anodontostoma,chacunda,220,NC,Adult,Vert.Ecto,,,Anodontostoma chacunda 1,Clupeidae Anodontostoma chacunda Adult,Clupeidae Anodontostoma chacunda652,Anodontostoma chacunda A1,140,Clupeidae,Anodontostoma,chacunda,140,NC,Adult,Vert.Ecto,,,Anodontostoma chacunda 2,Clupeidae Anodontostoma chacunda Adult,Clupeidae Anodontostoma chacunda654,Gobiidae (Priolepis sp.) L,3.4,Gobiidae,Priolepis,,3.4,NC,Larvae,Vert.Ecto,,,Gobiidae larvae (Priolepis sp.),Gobiidae Priolepis sp. larvae,Gobiidae Priolepis sp. 655,Gobiidae (Trypauchen sp.) L1,6.2,Gobiidae,Trypauchen,,6.2,NC,Larvae,Vert.Ecto,,,Gobiidae larvae (Trypauchen sp.) 1,Gobiidae Trypauchen sp. larvae,Gobiidae Trypauchen sp. 656,Gobiidae (Trypauchen sp.) L2,8.8,Gobiidae,Trypauchen,,8.8,NC,Larvae,Vert.Ecto,,,Gobiidae larvae (Trypauchen sp.) 2,Gobiidae Trypauchen sp. larvae,Gobiidae Trypauchen sp. 661,Stolephorus sp. AF,85,Engraulidae,Stolephorus,,85,NC,Adult,Vert.Ecto,,,Adult f Stolephorus sp.,Engraulidae Stolephorus sp. Adult,Engraulidae Stolephorus sp.662,Lepidotrigla bispinosa (max length from fishbase) A,160,Triglidae,Lepidotrigla,bispinosa,160,NC,Adult,Vert.Ecto,,,Lepidotrigla bispinosa (max length from fishbase),Triglidae Lepidotrigla bispinosa Adult,Triglidae Lepidotrigla bispinosa 663,Lepidotrigla spiloptera (max length from fishbase) A,100,Triglidae,Lepidotrigla,spiloptera,100,NC,Adult,Vert.Ecto,,,Lepidotrigla spiloptera (max length from fishbase),Triglidae Lepidotrigla spiloptera Adult,Triglidae Lepidotrigla spiloptera664,Pterygotrigla arabica (max length from fishbase) A,198,Triglidae,Pterygotrigla,arabica,198,NC,Adult,Vert.Ecto,,,Pterygotrigla arabica (max length from fishbase),Triglidae Pterygotrigla arabica Adult,Triglidae Pterygotrigla arabica 671,solefish larvae (Kuwait) L1,3.7,Soleidae,,(Kuwait 1),3.7,C,Larvae,Vert.Ecto,,,solefish larvae (Kuwait) 1,Soleidae solefish (Kuwait) 1  larvae,Soleidae solefish (Kuwait) 1  672,solefish larvae (Kuwait) L2,5.3,Soleidae,,(Kuwait 2),5.3,C,Larvae,Vert.Ecto,,,solefish larvae (Kuwait) 2,Soleidae solefish (Kuwait) 2  larvae,Soleidae solefish (Kuwait) 2  673,Isopsetta isolepis L1,4.3,Soleidae,Isopsetta,isolepis,4.3,C,Larvae,Vert.Ecto,,,solefish larvae (Isopsetta isolepis) 1,Soleidae solefish Isopsetta isolepis larvae,Soleidae solefish Isopsetta isolepis 674,Isopsetta isolepis L2,7.95,Soleidae,Isopsetta,isolepis,7.95,C,Larvae,Vert.Ecto,,,solefish larvae (Isopsetta isolepis) 2,Soleidae solefish Isopsetta isolepis larvae,Soleidae solefish Isopsetta isolepis 677,Isopsetta isolepis L3,11.95,Soleidae,Isopsetta,isolepis,11.95,C,Larvae,Vert.Ecto,,,solefish larvae (Isopsetta isolepis) 3,Soleidae solefish Isopsetta isolepis larvae,Soleidae solefish Isopsetta isolepis 678,Isopsetta isolepis L5,17.55,Soleidae,Isopsetta,isolepis,17.55,C,Larvae,Vert.Ecto,,,solefish larvae (Isopsetta isolepis) 4,Soleidae solefish Isopsetta isolepis larvae,Soleidae solefish Isopsetta isolepis 679,Isopsetta isolepis L4,15.95,Soleidae,Isopsetta,isolepis,15.95,C,Larvae,Vert.Ecto,,,solefish larvae (Isopsetta isolepis) 5,Soleidae solefish Isopsetta isolepis larvae,Soleidae solefish Isopsetta isolepis 680,Isopsetta isolepis L7,19.45,Soleidae,Isopsetta,isolepis,19.45,C,Larvae,Vert.Ecto,,,solefish larvae (Isopsetta isolepis) 6,Soleidae solefish Isopsetta isolepis larvae,Soleidae solefish Isopsetta isolepis 683,Isopsetta isolepis L6,17.95,Soleidae,Isopsetta,isolepis,17.95,C,Larvae,Vert.Ecto,,,solefish larvae (Isopsetta isolepis) 7,Soleidae solefish Isopsetta isolepis larvae,Soleidae solefish Isopsetta isolepis 684,Parophrys vetulus L1,6.75,Soleidae,Parophrys,vetulus,6.75,C,Larvae,Vert.Ecto,,,solefish larvae (Parophrys vetulus) 1,Soleidae solefish Parophrys vetulus larvae,Soleidae solefish Parophrys vetulus 685,Parophrys vetulus L3,11.95,Soleidae,Parophrys,vetulus,11.95,C,Larvae,Vert.Ecto,,,solefish larvae (Parophrys vetulus) 2,Soleidae solefish Parophrys vetulus larvae,Soleidae solefish Parophrys vetulus 686,Parophrys vetulus L5,15.95,Soleidae,Parophrys,vetulus,15.95,C,Larvae,Vert.Ecto,,,solefish larvae (Parophrys vetulus) 3,Soleidae solefish Parophrys vetulus larvae,Soleidae solefish Parophrys vetulus 687,Parophrys vetulus L6,20.2,Soleidae,Parophrys,vetulus,20.2,C,Larvae,Vert.Ecto,,,solefish larvae (Parophrys vetulus) 4,Soleidae solefish Parophrys vetulus larvae,Soleidae solefish Parophrys vetulus 688,Parophrys vetulus L2,7.45,Soleidae,Parophrys,vetulus,7.45,C,Larvae,Vert.Ecto,,,solefish larvae (Parophrys vetulus) 5,Soleidae solefish Parophrys vetulus larvae,Soleidae solefish Parophrys vetulus 689,Parophrys vetulus L4,12.95,Soleidae,Parophrys,vetulus,12.95,C,Larvae,Vert.Ecto,,,solefish larvae (Parophrys vetulus) 6,Soleidae solefish Parophrys vetulus larvae,Soleidae solefish Parophrys vetulus 690,Bothidae larvae (Kuwait) L,13.4,Bothidae,,(Kuwait),13.4,C,Larvae,Vert.Ecto,,,Bothidae larvae (Kuwait),Bothidae (Kuwait) larvae,Bothidae (Kuwait) 691,Arnoglossus laterna L1,3.495,Bothidae,Arnoglossus,laterna,3.495,C,Larvae,Vert.Ecto,,,Bothidae larvae (Arnoglossus laterna) 1,Bothidae Arnoglossus laterna larvae,Bothidae Arnoglossus laterna 692,Arnoglossus laterna L2,4.495,Bothidae,Arnoglossus,laterna,4.495,C,Larvae,Vert.Ecto,,,Bothidae larvae (Arnoglossus laterna) 2,Bothidae Arnoglossus laterna larvae,Bothidae Arnoglossus laterna 693,Arnoglossus laterna L3,5.495,Bothidae,Arnoglossus,laterna,5.495,C,Larvae,Vert.Ecto,,,Bothidae larvae (Arnoglossus laterna) 3,Bothidae Arnoglossus laterna larvae,Bothidae Arnoglossus laterna 694,Arnoglossus laterna L4,6.495,Bothidae,Arnoglossus,laterna,6.495,C,Larvae,Vert.Ecto,,,Bothidae larvae (Arnoglossus laterna) 4,Bothidae Arnoglossus laterna larvae,Bothidae Arnoglossus laterna 695,Arnoglossus laterna L5,7.495,Bothidae,Arnoglossus,laterna,7.495,C,Larvae,Vert.Ecto,,,Bothidae larvae (Arnoglossus laterna) 5,Bothidae Arnoglossus laterna larvae,Bothidae Arnoglossus laterna 696,Arnoglossus laterna L6,8,Bothidae,Arnoglossus,laterna,8,C,Larvae,Vert.Ecto,,,Bothidae larvae (Arnoglossus laterna) 6,Bothidae Arnoglossus laterna larvae,Bothidae Arnoglossus laterna 697,Callionymus (Kuwait) L1,1.9,Callionymidae,Callionymus,(Kuwait 1),1.9,NC,Larvae,Vert.Ecto,,,Callionymus larvae (Kuwait) 1,Callionymidae Callionymus (Kuwait 1) larvae ,Callionymidae Callionymus (Kuwait 1) 698,Callionymus (Kuwait) L2,2.9,Callionymidae,Callionymus,(Kuwait 2),2.9,NC,Larvae,Vert.Ecto,,,Callionymus larvae (Kuwait) 2,Callionymidae Callionymus (Kuwait 2) larvae ,Callionymidae Callionymus (Kuwait 2) 699,Callionymus (Kuwait) L3,5.1,Callionymidae,Callionymus,(Kuwait 3),5.1,NC,Larvae,Vert.Ecto,,,Callionymus larvae (Kuwait) 3,Callionymidae Callionymus (Kuwait 3) larvae ,Callionymidae Callionymus (Kuwait 3) 700,Callionymus sp. (Sanchez-Velasco 1998) L1,2.495,Callionymidae,Callionymus,,2.495,NC,Larvae,Vert.Ecto,,,Callionymus sp. larvae (Sanchez-Velasco 1998) 1,Callionymidae Callionymus sp. (Sanchez-Velasco 1998) larvae,Callionymidae Callionymus sp. (Sanchez-Velasco 1998) 701,Callionymus sp. (Sanchez-Velasco 1998) L2,3.495,Callionymidae,Callionymus,,3.495,NC,Larvae,Vert.Ecto,,,Callionymus sp. larvae (Sanchez-Velasco 1998) 2,Callionymidae Callionymus sp. (Sanchez-Velasco 1998) larvae,Callionymidae Callionymus sp. (Sanchez-Velasco 1998) 702,Callionymus sp. (Sanchez-Velasco 1998) L3,4.495,Callionymidae,Callionymus,,4.495,NC,Larvae,Vert.Ecto,,,Callionymus sp. larvae (Sanchez-Velasco 1998) 3,Callionymidae Callionymus sp. (Sanchez-Velasco 1998) larvae,Callionymidae Callionymus sp. (Sanchez-Velasco 1998) 621,Callionymus sp. (Sanchez-Velasco 1998) L4,5.495,Callionymidae,Callionymus,,5.495,NC,Larvae,Vert.Ecto,,,Callionymus sp. larvae (Sanchez-Velasco 1998) 4,Callionymidae Callionymus sp. (Sanchez-Velasco 1998) larvae,Callionymidae Callionymus sp. (Sanchez-Velasco 1998) 704,Callionymus sp. (Sanchez-Velasco 1998) L5,6.495,Callionymidae,Callionymus,,6.495,NC,Larvae,Vert.Ecto,,,Callionymus sp. larvae (Sanchez-Velasco 1998) 5,Callionymidae Callionymus sp. (Sanchez-Velasco 1998) larvae,Callionymidae Callionymus sp. (Sanchez-Velasco 1998) 705,Callionymus carebares A,180,Callionymidae,Callionymus,carebares,180,NC,Adult,Vert.Ecto,,,Callionymus carebares,Callionymidae Callionymus carebares Adult,Callionymidae Callionymus carebares 706,Callionymus erythraeus A,100,Callionymidae,Callionymus,erythraeus,100,NC,Adult,Vert.Ecto,,,Callionymus erythraeus,Callionymidae Callionymus erythraeus Adult,Callionymidae Callionymus erythraeus 707,Callionymus hindsii A,90,Callionymidae,Callionymus,hindsii,90,NC,Adult,Vert.Ecto,,,Callionymus hindsii,Callionymidae Callionymus hindsii Adult,Callionymidae Callionymus hindsii708,Callionymus margaretae A,160,Callionymidae,Callionymus,margaretae,160,NC,Adult,Vert.Ecto,,,Callionymus margaretae,Callionymidae Callionymus margaretae Adult,Callionymidae Callionymus margaretae 709,Callionymus marleyi A,130,Callionymidae,Callionymus,marleyi,130,NC,Adult,Vert.Ecto,,,Callionymus marleyi,Callionymidae Callionymus marleyi Adult,Callionymidae Callionymus marleyi 710,Callionymus persicua A,129.67,Callionymidae,Callionymus,persicua,129.67,NC,Adult,Vert.Ecto,,,Callionymus persicua,Callionymidae Callionymus persicua Adult,Callionymidae Callionymus persicua 711,Dipolgrammus pygmaeus A,129.67,Callionymidae,Dipolgrammus,pygmaeus,129.67,NC,Adult,Vert.Ecto,,,Dipolgrammus pygmaeus,Callionymidae Dipolgrammus pygmaeus Adult,Callionymidae Dipolgrammus pygmaeus 712,Pteropod L,0.15,Pteropoda,Pteropod,,0.15,NC,Larvae,Invert,,,Pteropod larvae,Pteropoda Pteropod larvae,Pteropoda Pteropod 714,Paracalanus copepodides J,0.51,Paracalanidae,Paracalanus,,0.51,NC,Juvenile,Invert,,,Paracalanus copepodides,Paracalanidae Paracalanus Juvenile,Paracalanidae Paracalanus 715,Oithona copepodides J,0.4,Oithonidae,Oithona,,0.4,NC,Juvenile,Invert,,,Oithona copepodides,Oithonidae Oithona Juvenile,Oithonidae Oithona 716,Microsetella copepodites J,0.38,Ectinosomatidae,Microsetella,,0.38,NC,Juvenile,Invert,,,Microsetella copepodites,Ectinosomatidae Microsetella Juvenile,Ectinosomatidae Microsetella 717,Centropages copepodites J,0.78,Centropagidae,Centropages,,0.78,NC,Juvenile,Invert,,,Centropages copepodites,Centropagidae Centropages Juvenile,Centropagidae Centropages 718,Oncaea copepodites J,0.52,Oncaeidae,Oncaea,,0.52,NC,Juvenile,Invert,,,Oncaea copepodites,Oncaeidae Oncaea Juvenile,Oncaeidae Oncaea 719,gastropod L,0.553,Gastropoda,gastropod,,0.553,NC,Larvae,Auto,,,gastropod larvae,Gastropoda gastropod larvae,Gastropoda gastropod 720,Chaetoceros socialis A,0.035,Chaetocerotaceae,Chaetoceros,socialis,0.035,NC,Adult,Auto,,,Chaetoceros socialis ,Chaetocerotaceae Chaetoceros socialis Adult,Chaetocerotaceae Chaetoceros socialis 721,picoplankton A,0.001,picoplankton,,,0.001,NC,Adult,N/A,,,picoplankton,picoplankton Adult,picoplankton 722,nanoplankton A1,0.0025,nanoplankton,,,0.0025,NC,Adult,N/A,,,nanoplankton 1,nanoplankton Adult,nanoplankton 723,nanoplankton A2,0.005,nanoplankton,,,0.005,NC,Adult,N/A,,,nanoplankton 2,nanoplankton Adult,nanoplankton 724,nanoplankton A3,0.0075,nanoplankton,,,0.0075,NC,Adult,N/A,,,nanoplankton 3,nanoplankton Adult,nanoplankton 725,Leptocylindrus minimus A,0.0225,Leptocylindraceae,Leptocylindrus,minimus,0.0225,NC,Adult,Auto,,,Leptocylindrus minimus,Leptocylindraceae Leptocylindrus minimus Adult,Leptocylindraceae Leptocylindrus minimus 726,Leptocylindrus danicus A,0.04,Leptocylindraceae,Leptocylindrus,danicus,0.04,NC,Adult,Auto,,,Leptocylindrus danicus,Leptocylindraceae Leptocylindrus danicus Adult,Leptocylindraceae Leptocylindrus danicus 728,Pseudonitzschia pungens A,0.095,Bacillariaceae,Pseudonitzschia,pungens,0.095,NC,Adult,Auto,,,Pseudonitzschia pungens,Bacillariaceae Pseudonitzschia pungens Adult,Bacillariaceae Pseudonitzschia pungens 729,Pseudonitzschia sp. A,0.09,Bacillariaceae,Pseudonitzschia,,0.09,NC,Adult,Auto,,,Pseudonitzschia sp.,Bacillariaceae Pseudonitzschia sp. Adult,Bacillariaceae Pseudonitzschia sp. 730,Thalassionema nitzschioides A,0.025,Thalassionemataceae,Thalassionema,nitzschioides,0.025,NC,Adult,Auto,,,Thalassionema nitzschioides,Thalassionemataceae Thalassionema nitzschioides Adult,Thalassionemataceae Thalassionema nitzschioides 731,Ciliate spp. A,0.015,Ciliate ,,,0.015,NC,Adult,Auto,,,Ciliate spp.,Ciliate spp. Adult,Ciliate spp. 732,Cyst E,0.0375,Cyst,,,0.0375,NC,Egg,Auto,,,Cyst,Cyst Egg,Cyst733,Phaeocystis pouchetii A,0.0075,Phaeocystaceae,Phaeocystis,pouchetii,0.0075,NC,Adult,Auto,,,Phaeocystis pouchetii,Phaeocystaceae Phaeocystis pouchetii Adult,Phaeocystaceae Phaeocystis pouchetii 734,Distephanus speculum A,0.0425,Dictyochaceae,Distephanus,speculum,0.0425,NC,Adult,Auto,,,Distephanus speculum,Dictyochaceae Distephanus speculum Adult,Dictyochaceae Distephanus speculum 735,Rhodomonas sp. A,0.015,Pyrenomonadaceae,Rhodomonas,,0.015,NC,Adult,Auto,,,Rhodomonas sp.,Pyrenomonadaceae Rhodomonas sp. Adult,Pyrenomonadaceae Rhodomonas sp. 736,Dinophysis acuminata A,0.055,Dinophysiaceae,Dinophysis,acuminata,0.055,NC,Adult,Auto,,,Dinophysis acuminata,Dinophysiaceae Dinophysis acuminata Adult,Dinophysiaceae Dinophysis acuminata 737,Dinophysis acuta A,0.045,Dinophysiaceae,Dinophysis,acuta,0.045,NC,Adult,Auto,,,Dinophysis acuta,Dinophysiaceae Dinophysis acuta Adult,Dinophysiaceae Dinophysis acuta 