Code no., node,M,Family,Genus,Species,Length(mm),C.NC,Stage,Category,Sex,Age,oldnode,New name for sp food web (Family-Genus-Species-Stage-Substage-Other info),New name for sp food web (Family-Genus-Species)1,Sparidae sp. 1 L,15.5,Sparidae,,,15.5,C,Larvae,Vert.Ecto,,,Sparidae larvae sp. 1,Sparidae sp. 1  larvae,Sparidae sp. 1  2,Sparidae sp. 2 L,5.3,Sparidae,,,5.3,C,Larvae,Vert.Ecto,,,Sparidae larvae sp. 2,Sparidae sp. 2 larvae,Sparidae sp. 23,Sparidae sp. 3 L,6.9,Sparidae,,,6.9,C,Larvae,Vert.Ecto,,,Sparidae larvae sp. 3,Sparidae sp. 3  larvae,Sparidae sp. 34,Sparidae sp. 4 L,6.8,Sparidae,,,6.8,C,Larvae,Vert.Ecto,,,Sparidae larvae sp. 4,Sparidae sp. 4 larvae,Sparidae sp. 45,Sparidae sp. 5 L,11.5,Sparidae,,,11.5,C,Larvae,Vert.Ecto,,,Sparidae larvae sp. 5,Sparidae sp. 5 larvae ,Sparidae sp. 56,Sparidae sp. 6 L,5.3,Sparidae,,,5.3,C,Larvae,Vert.Ecto,,,Sparidae larvae sp. 6,Sparidae sp. 6  larvae,Sparidae sp. 67,Sparidae sp. 7 L,15.5,Sparidae,,,15.5,C,Larvae,Vert.Ecto,,,Sparidae larvae sp. 7,Sparidae sp. 7  larvae,Sparidae sp. 78,Stromateidae sp. 1 L,3.6,Stromateidae,,,3.6,C,Larvae,Vert.Ecto,,,Stromateidae larvae sp. 1,Stromateidae sp. 1 larvae ,Stromateidae sp. 1 9,Stromateidae sp. 2 L,5.6,Stromateidae,,,5.6,C,Larvae,Vert.Ecto,,,Stromateidae larvae sp. 2,Stromateidae sp. 2 larvae ,Stromateidae sp. 210,Stromateidae sp. 3 L,2,Stromateidae,,,2,C,Larvae,Vert.Ecto,,,Stromateidae larvae sp. 3,Stromateidae sp. 3  larvae,Stromateidae sp. 311,Serranidae sp. 1 L,7.5,Serranidae,,,7.5,C,Larvae,Vert.Ecto,,,Serranidae larvae sp. 1,Serranidae sp. 1 larvae,Serranidae sp. 1 12,Serranidae sp. 2 L,3.7,Serranidae,,,3.7,C,Larvae,Vert.Ecto,,,Serranidae larvae sp. 2,Serranidae sp. 2 larvae,Serranidae sp. 213,Serranidae sp. 3 L,4.5,Serranidae,,,4.5,C,Larvae,Vert.Ecto,,,Serranidae larvae sp. 3,Serranidae sp. 3 larvae,Serranidae sp. 314,Serranidae sp. 4 L,3.25,Serranidae,,,3.25,C,Larvae,Vert.Ecto,,,Serranidae larvae sp. 4,Serranidae sp. 4  larvae ,Serranidae sp. 415,Serranidae sp. 5 L,3.5,Serranidae,,,3.5,C,Larvae,Vert.Ecto,,,Serranidae larvae sp. 5,Serranidae sp. 5  larvae,Serranidae sp. 516,Serranidae sp. 6 L,2,Serranidae,,,2,C,Larvae,Vert.Ecto,,,Serranidae larvae sp. 6,Serranidae sp. 6  larvae,Serranidae sp. 617,Epinephelus coioides A,540,Serranidae,Epinephelus ,coioides,540,C,Adult,Vert.Ecto,,,Epinephelus coioides,Serranidae Epinephelus coioides Adult,Serranidae Epinephelus coioides18,Diodora funiculata A,30,Fissurellidae  ,Diodora ,funiculata,30,NC,Adult,Invert,,,Diodora funiculata,Fissurellidae Diodora funiculata Adult,Fissurellidae Diodora funiculata 19,Diodora rueppelli A,30,Fissurellidae,Diodora ,rueppelli,30,NC,Adult,Invert,,,Diodora rueppelli,Fissurellidae Diodora rueppelli Adult,Fissurellidae Diodora rueppelli 20,Torchus erythraeus A,35,Tochidae  ,Torchus ,erythraeus,35,NC,Adult,Invert,,,Torchus erythraeus,Tochidae Torchus erythraeus Adult,Tochidae Torchus erythraeus 21,Monodonta australis A,25,Tochidae ,Monodonta, australis ,25,NC,Adult,Invert,,,Monodonta australis,Tochidae Monodonta australis Adult,Tochidae Monodonta australis 22,Priotrochus obscura A,20,Tochidae ,Priotrochus ,obscura ,20,NC,Adult,Invert,,,Priotrochus obscura,Tochidae Priotrochus obscura Adult,Tochidae Priotrochus obscura 23,Umbonium vestiarium A,12,Tochidae ,Umbonium, vestiarium ,12,NC,Adult,Invert,,,Umbonium vestiarium,Tochidae Umbonium vestiarium Adult,Tochidae Umbonium vestiarium 24,Euchelus asper A,18,Tochidae ,Euchelus,asper,18,NC,Adult,Invert,,,Euchelus asper,Tochidae Euchelus asper Adult,Tochidae Euchelus asper 25,Pseudostomatella elegans A,25,Stomatellidae,Pseudostomatella,elegans ,25,NC,Adult,Invert,,,Pseudostomatella elegans,Stomatellidae Pseudostomatella elegans Adult,Stomatellidae Pseudostomatella elegans 26,Lunella coronatus A,40,Turbinidae ,Turbinidae, Lunella coronatus ,40,NC,Adult,Invert,,,Lunella coronatus,Turbinidae Lunella coronatus Adult,Turbinidae Lunella coronatus 27,Nodilittorina subnodosa A,10,Littorinidae ,Nodilittorina ,subnodosa ,10,NC,Adult,Invert,,,Nodilittorina subnodosa,Littorinidae Nodilittorina subnodosa Adult,Littorinidae Nodilittorina subnodosa 28,Planaxis sulcatus A,12,Planaxidae ,Planaxis ,sulcatus,12,NC,Adult,Invert,,,Planaxis sulcatus,Planaxidae Planaxis sulcatus Adult,Planaxidae Planaxis sulcatus 29,Cerithidea cingulata A,35,Potamididae  ,Cerithidea ,cingulata,35,NC,Adult,Invert,,,Cerithidea cingulata,Potamididae Cerithidea cingulata Adult,Potamididae Cerithidea cingulata 30,Pirinella conica A,30,Potamididae ,Pirinella ,conica,30,NC,Adult,Invert,,,Pirinella conica,Potamididae Pirinella conica Adult,Potamididae Pirinella conica 31,Serpulorbis (Vermetus) sulcatus A,5,Vermetidae ,Serpulorbis (Vermetus) ,sulcatus,5,NC,Adult,Invert,,,Serpulorbis (Vermetus) sulcatus,Vermetidae Serpulorbis (Vermetus) sulcatus Adult,Vermetidae Serpulorbis (Vermetus) sulcatus 32,Cerithium scabridum A,10,Cerithiidae,Cerithium ,scabridum ,10,NC,Adult,Invert,,,Cerithium scabridum ,Cerithiidae Cerithium scabridum Adult,Cerithiidae Cerithium scabridum 33,Clypeomorus caeruleum A,30,Cerithiidae ,Clypeomorus ,caeruleum,30,NC,Adult,Invert,,,Clypeomorus caeruleum ,Cerithiidae Clypeomorus caeruleum Adult,Cerithiidae Clypeomorus caeruleum 34,Clypeomorus bifasciata A,20,Cerithiidae,Clypeomorus ,bifascia,20,NC,Adult,Invert,,,Clypeomorus bifasciata,Cerithiidae Clypeomorus bifasciata Adult,Cerithiidae Clypeomorus bifasciata 35,Strombus decorus persicus A,45,Strombidae,Strombus ,decorus persicus,45,NC,Adult,Invert,,,Strombus decorus persicus,Strombidae Strombus decorus persicus Adult,Strombidae Strombus decorus persicus 36,Cypraea turdus A,35,Cypraeidae ,Cypraea, turdus ,35,NC,Adult,Invert,,,Cypraea turdus ,Cypraeidae Cypraea turdus Adult,Cypraeidae Cypraea turdus 37,Cypraea gracilis A,17,Cypraeidae,Cypraeidae ,gracilis  ,17,NC,Adult,Invert,,,Cypraea gracilis,Cypraeidae Cypraea gracilis Adult,Cypraeidae Cypraea gracilis 38,Hexaplex kuesterianus A,100,Muricidae ,Hexaplex ,kuesterianus ,100,NC,Adult,Invert,,,Hexaplex kuesterianus,Muricidae Hexaplex kuesterianus Adult,Muricidae Hexaplex kuesterianus 39,Murex scoloplax A,100,Muricidae ,Murex ,scoloplax,100,NC,Adult,Invert,,,Murex scoloplax,Muricidae Murex scoloplax Adult,Muricidae Murex scoloplax 40,Cronia margariticola A,20,Thaididae,Cronia,margariticola,20,NC,Adult,Invert,,,Cronia margariticola,Thaididae Cronia margariticola Adult,Thaididae Cronia margariticola 41,Thais tissoti A,25,Thaididae ,Thais,tissoti,25,NC,Adult,Invert,,,Thais tissoti,Thaididae Thais tissoti Adult,Thaididae Thais tissoti 42,Thais savignyi = pseudohippocastanum A,50,Thaididae,Thais  ,savignyi,50,NC,Adult,Invert,,,Thais savignyi = pseudohippocastanum,Thaididae Thais savignyi = pseudohippocastanum Adult,Thaididae Thais savignyi = pseudohippocastanum 43,Thais mutabilis = carinifera A,40,Thaididae ,Thais,mutabilis=carinifera ,40,NC,Adult,Invert,,,Thais mutabilis = carinifera,Thaididae Thais mutabilis = carinifera Adult,Thaididae Thais mutabilis = carinifera 44,Rapana bulbosa A,130,Thaididae,Rapana  ,bulbosa,130,NC,Adult,Invert,,,Rapana bulbosa,Thaididae Rapana bulbosa Adult,Thaididae Rapana bulbosa 45,Mitrella blanda A,15,Columbellidae ,Mitrella,blanda,15,NC,Adult,Invert,,,Mitrella blanda,Columbellidae Mitrella blanda Adult,Columbellidae Mitrella blanda 46,Nassarius arcularius plicatus A,18,Nassariidae ,Nassarius ,arcularius plicatus ,18,NC,Adult,Invert,,,Nassarius arcularius plicatus,Nassariidae Nassarius arcularius plicatus Adult,Nassariidae Nassarius arcularius plicatus 47,Fusinus townsendi A,90,Fasciolariidae ,Fusinus ,townsendi ,90,NC,Adult,Invert,,,Fusinus townsendi,Fasciolariidae Fusinus townsendi Adult,Fasciolariidae Fusinus townsendi 48,Ancilla castanea A,30,Olividae ,Ancilla ,castanea ,30,NC,Adult,Invert,,,Ancilla castanea,Olividae Ancilla castanea Adult,Olividae Ancilla castanea 49,Terebra livida A,35,Terebridae,Terebra,livida ,35,NC,Adult,Invert,,,Terebra livida,Terebridae Terebra livida Adult,Terebridae Terebra livida 50,Bullaria ampulla A,40,Bullidae,Bullaria ,ampulla,40,NC,Adult,Invert,,,Bullaria ampulla,Bullidae Bullaria ampulla Adult,Bullidae Bullaria ampulla 51,Siphonaria kurracheensis A,30,Siphonariidae ,Siphonaria,kurracheensis ,30,NC,Adult,Invert,,,Siphonaria kurracheensis,Siphonariidae Siphonaria kurracheensis Adult,Siphonariidae Siphonaria kurracheensis 52,Ischnochiton yerburyi A,15,Ischnochitonidae ,Ischnochiton ,yerburyi,15,NC,Adult,Invert,,,Ischnochiton yerburyi,Ischnochitonidae Ischnochiton yerburyi Adult,Ischnochitonidae Ischnochiton yerburyi 53,Dentalium octangulatum A,40,Dentaliidae,Dentalium,octangulatum,40,NC,Adult,Invert,,,Dentalium octangulatum,Dentaliidae Dentalium octangulatum Adult,Dentaliidae Dentalium octangulatum 54,Barbatia helblingii A,60,Arcidae,Arcidae,helblingii,60,NC,Adult,Invert,,,Barbatia helblingii,Arcidae Barbatia helblingii Adult,Arcidae Barbatia helblingii 55,Barbatia plicata A,30,Arcidae,Barbatia,plicata,30,NC,Adult,Invert,,,Barbatia plicata,Arcidae Barbatia plicata Adult,Arcidae Barbatia plicata 56,Striarca sculptilis A,35,Arcidae,Striarca,sculptilis,35,NC,Adult,Invert,,,Striarca sculptilis,Arcidae Striarca sculptilis Adult,Arcidae Striarca sculptilis 57,Anadara ehrengbergi A,80,Arcidae,Anadara,ehrengbergi,80,NC,Adult,Invert,,,Anadara ehrengbergi,Arcidae Anadara ehrengbergi Adult,Arcidae Anadara ehrengbergi 58,Isognomon dentifera A,12,Isognomonidae,Isognomon,dentifera,12,NC,Adult,Invert,,,Isognomon dentifera,Isognomonidae Isognomon dentifera Adult,Isognomonidae Isognomon dentifera 59,Malleus regula A,90,Isognomonidae,Malleus,regula,90,NC,Adult,Invert,,,Malleus regula,Isognomonidae Malleus regula Adult,Isognomonidae Malleus regula 60,Pinctada radiata A,90,Pteriidae,Pinctada,radiata,90,NC,Adult,Invert,,,Pinctada radiata,Pteriidae Pinctada radiata Adult,Pteriidae Pinctada radiata 61,Brachidontes variabilis A,12,Mytilidae ,Brachidontes ,variabilis,12,NC,Adult,Invert,,,Brachidontes variabilis,Mytilidae Brachidontes variabilis Adult,Mytilidae Brachidontes variabilis 62,Brachidontes emarginatus A,12,Mytilidae ,Brachidontes,emarginatus,12,NC,Adult,Invert,,,Brachidontes emarginatus,Mytilidae Brachidontes emarginatus Adult,Mytilidae Brachidontes emarginatus63,Lithophaga malaccana A,50,Mytilidae ,Lithophaga,malaccana,50,NC,Adult,Invert,,,Lithophaga malaccana,Mytilidae Lithophaga malaccana Adult,Mytilidae Lithophaga malaccana64,Pinna bicolor A,240,Pinnidae,Pinna ,bicolor,240,NC,Adult,Invert,,,Pinna bicolor,Pinnidae Pinna bicolor Adult,Pinnidae Pinna bicolor65,Chlamys ruschenbergerii A,90,Pectinidae,Chlamys,ruschenbergerii,90,NC,Adult,Invert,,,Chlamys ruschenbergerii,Pectinidae Chlamys ruschenbergerii Adult,Pectinidae Chlamys ruschenbergerii66,Spondylus marisrubri A,80,Spondylidae,Spondylidae,marisrubri,80,NC,Adult,Invert,,,Spondylus marisrubri,Spondylidae Spondylus marisrubri Adult,Spondylidae Spondylus marisrubri67,Crassostrea cf. margaritacea A,100,Osteridae,Crassostrea,margaritacea,100,NC,Adult,Invert,,,Crassostrea cf. margaritacea,Osteridae Crassostrea cf. margaritacea Adult,Osteridae Crassostrea cf. margaritacea68,Trapezium sublaevigatum A,30,Trapeziidae,Trapezium,sublaevigatum,30,NC,Adult,Invert,,,Trapezium sublaevigatum,Trapeziidae Trapezium sublaevigatum Adult,Trapeziidae Trapezium sublaevigatum69,Chama aspera A,60,Chamidae,Chama,aspera,60,NC,Adult,Invert,,,Chama aspera,Chamidae Chama aspera Adult,Chamidae Chama aspera70,Diplodonta globosa A,35,Ungulinidae,Diplodonta,globosa,35,NC,Adult,Invert,,,Diplodonta globosa,Ungulinidae Diplodonta globosa Adult,Ungulinidae Diplodonta globosa71,Callista florida A,30,Veneridae,Callista,florida,30,NC,Adult,Invert,,,Callista florida,Veneridae Callista florida Adult,Veneridae Callista florida72,Circe scripta A,45,Veneridae,Circe,scripta,45,NC,Adult,Invert,,,Circe scripta,Veneridae Circe scripta Adult,Veneridae Circe scripta73,Circe (Circenita) callipyga A,50,Veneridae,Circe (Circenita),callipyga ,50,NC,Adult,Invert,,,Circe (Circenita) callipyga,Veneridae Circe (Circenita) callipyga Adult,Veneridae Circe (Circenita) callipyga74,Dosinia caelata A,30,Veneridae,Dosinia,caelata,30,NC,Adult,Invert,,,Dosinia caelata,Veneridae Dosinia caelata Adult,Veneridae Dosinia caelata75,Marcia hiantina A,40,Veneridae,Marcia,hiantina,40,NC,Adult,Invert,,,Marcia hiantina,Veneridae Marcia hiantina Adult,Veneridae Marcia hiantina76,Marcia optima A,40,Veneridae,Marcia,optima,40,NC,Adult,Invert,,,Marcia optima,Veneridae Marcia optima Adult,Veneridae Marcia optima77,Paphia gallus A,50,Veneridae,Paphia,gallus,50,NC,Adult,Invert,,,Paphia gallus,Veneridae Paphia gallus Adult,Veneridae Paphia gallus78,Paphia texile A,30,Veneridae,Paphia,texile,30,NC,Adult,Invert,,,Paphia texile,Veneridae Paphia texile Adult,Veneridae Paphia texile79,Katelysia sp. A,70,Veneridae,Katelysia,,70,NC,Adult,Invert,,,Katelysia sp.,Veneridae Katelysia sp. Adult,Veneridae Katelysia sp. 80,Meretrix meretrix A,40,Veneridae,Meretrix ,meretrix,40,NC,Adult,Invert,,,Meretrix meretrix,Veneridae Meretrix meretrix Adult,Veneridae Meretrix meretrix 81,Tapes sulcarius A,40,Veneridae,Tapes,sulcarius,40,NC,Adult,Invert,,,Tapes sulcarius ,Veneridae Tapes sulcarius Adult,Veneridae Tapes sulcarius 82,Timoclea farsiana A,12,Veneridae,Timoclea,farsiana,12,NC,Adult,Invert,,,Timoclea farsiana ,Veneridae Timoclea farsiana Adult,Veneridae Timoclea farsiana 83,Mactra lilacea A,39,Mactridae,Mactra,lilacea,39,NC,Adult,Invert,,,Mactra lilacea,Mactridae Mactra lilacea Adult,Mactridae Mactra lilacea 84,Donax scalpellum A,30,Donacidae,Donax,scalpellum,30,NC,Adult,Invert,,,Donax scalpellum,Donacidae Donax scalpellum Adult,Donacidae Donax scalpellum 85,Gari maculosa A,40,Psammobiidae,Gari,maculosa,40,NC,Adult,Invert,,,Gari maculosa,Psammobiidae Gari maculosa Adult,Psammobiidae Gari maculosa 86,Gari roseus A,70,Psammobiidae,Gari,roseus,70,NC,Adult,Invert,,,Gari roseus,Psammobiidae Gari roseus Adult,Psammobiidae Gari roseus 87,Tellidora pellyana A,15,Tellinidae,Tellidora,pellyana,15,NC,Adult,Invert,,,Tellidora pellyana,Tellinidae Tellidora pellyana Adult,Tellinidae Tellidora pellyana 88,Angulus adenensis A,30,Tellinidae,Angulus,adenensis,30,NC,Adult,Invert,,,Angulus adenensis,Tellinidae Angulus adenensis Adult,Tellinidae Angulus adenensis 89,Solen vagina A,100,Solenidae,Solen,vagina,100,NC,Adult,Invert,,,solen vagina,Solenidae solen vagina Adult,Solenidae solen vagina 90,Aspidopholas cf. ovum A,60,Martesiinae,Aspidopholas,ovum,60,NC,Adult,Invert,,,Aspidopholas cf. ovum,Martesiinae Aspidopholas cf. ovum Adult,Martesiinae Aspidopholas cf. ovum 91,Laternula navicula A,60,Laternulidae,Laternula ,navicula,60,NC,Adult,Invert,,,Laternula navicula,Laternulidae Laternula navicula Adult,Laternulidae Laternula navicula92,Sepia pharaonis A,300,Sepiidae,pharaonis,pharaonis,300,NC,Adult,Invert,,,Sepia pharaonis,Sepiidae Sepia pharaonis Adult,Sepiidae Sepia pharaonis93,Pampus argenteus A2,194.5,Stromateidae,Pampus,argenteus,194.5,C,Adult,Vert.Ecto,,,Pampus argenteus(average size=194.5mm),Stromateidae Pampus Adult,Stromateidae Pampus argenteus94,Acanthopagrus latus J,183,Sparidae,Acanthopagrus,latus,183,C,Juvenile,Vert.Ecto,,,Acanthopagrus latus,Sparidae Acanthopagrus latus Juvenile,Sparidae Acanthopagrus latus 95,Sparidantex hasta A,350,Sparidae,Sparidantex,hasta,350,C,Adult,Vert.Ecto,,,Sparidantex hasta,Sparidae Sparidantex hasta Adult,Sparidae Sparidantex hasta 96,Acanthopagrus berda A,750,Sparidae,Acanthopagrus,berda,750,C,Adult,Vert.Ecto,,,Acanthopagrus berda,Sparidae Acanthopagrus berda Adult,Sparidae Acanthopagrus berda 97,Acanthopagrus bifasciatus J,115,Sparidae,Acanthopagrus,bifasciatus,115,C,Juvenile,Vert.Ecto,,,Acanthopagrus bifasciatus,Sparidae Acanthopagrus bifasciatus Juvenile,Sparidae Acanthopagrus bifasciatus 98,Penaeus semisulcaetus J2,41,Penaeidae,Penaeus,semisulcaetus,41,C,Juvenile,Invert,,,Penaeus semisulcaetus size-1,Penaeidae Penaeus semisulcaetus Juvenile ,Penaeidae Penaeus semisulcaetus 99,Penaeus semisulcaetus A,180,Penaeidae,Penaeus,semisulcaetus ,180,C,Adult,Invert,,,Penaeus semisulcaetus size-2,Penaeidae Penaeus semisulcaetus Adult ,Penaeidae Penaeus semisulcaetus 100,Metapenaeus affinis J2,41,Penaeidae,Metapenaeus,affinis,41,C,Juvenile,Invert,,,Metapenaeus affinis size-1,Penaeidae Metapenaeus affinis Juvenile ,Penaeidae Metapenaeus affinis 101,Metapenaeus affinis A,165,Penaeidae,Metapenaeus,affinis,165,C,Adult,Invert,,,Metapenaeus affinis size-2,Penaeidae Metapenaeus affinis Adult ,Penaeidae Metapenaeus affinis102,Parapenaeopsis stylifera J2,41,Penaeidae,Parapenaeopsis,stylifera,41,C,Juvenile,Invert,,,Parapenaeopsis stylifera size-1,Penaeidae Parapenaeopsis stylifera Juvenile ,Penaeidae Parapenaeopsis stylifera103,Parapenaeopsis stylifera A,145,Penaeidae,Parapenaeopsis,stylifera,145,C,Adult,Invert,,,Parapenaeopsis stylifera size-2,Penaeidae Parapenaeopsis stylifera Adult ,Penaeidae Parapenaeopsis stylifera 1088,Liza macrolepis J1,75,Mugilidae,Liza ,macrolepis,75,C,Juvenile,Vert.Ecto,,,Liza macrolepis (75mm),Mugilidae Liza macrolepis Juvenile ,Mugilidae Liza macrolepis 1089,Liza macrolepis J2,125,Mugilidae,Liza ,macrolepis,125,C,Juvenile,Vert.Ecto,,,Liza macrolepis (125mm),Mugilidae Liza macrolepis Juvenile ,Mugilidae Liza macrolepis 1090,Liza macrolepis J3,175,Mugilidae,Liza ,macrolepis,175,C,Juvenile,Vert.Ecto,,,Liza macrolepis (175mm),Mugilidae Liza macrolepis Juvenile,Mugilidae Liza macrolepis1091,Liza macrolepis A1,225,Mugilidae,Liza ,macrolepis,225,C,Adult,Vert.Ecto,,,Liza macrolepis (225mm),Mugilidae Liza macrolepis Adult ,Mugilidae Liza macrolepis 1092,Liza macrolepis A2,250,Mugilidae,Liza ,macrolepis,250,C,Adult,Vert.Ecto,,,Liza macrolepis (250mm),Mugilidae Liza macrolepis Adult ,Mugilidae Liza macrolepis 104,Liza kluzingeri A,350,Mugilidae,Liza,kluzengeri,350,C,Adult,Vert.Ecto,,,Liza kluzingeri,Mugilidae Liza kluzengeri Adult ,Mugilidae Liza macrolepis105,Thryssa hamiltoni A,250,Engraulidae,Thryssa,hamiltoni,250,NC,Adult,Vert.Ecto,,,Thryssa hamiltoni,Engraulidae Thryssa hamiltoni Adult,Engraulidae Thryssa hamiltoni 107,Leiognathus bindus J2,81.5,Leiognathidae,Leiognathus,bindus,81.5,NC,Juvenile,Vert.Ecto,,,Leiognathus bindus(81.5mm),Leiognathidae Leiognathus bindus Juvenile ,Leiognathidae Leiognathus bindus 106,Johnius belangerii A,151,Sciaenidae,Johnius,belangerii,151,NC,Adult,Vert.Ecto,,,Johnius belangerii,Sciaenidae Johnius belangerii Juvenile,Sciaenidae Johnius belangerii 108,Synodus sp. A,170,Synodontidae,Synodus,,170,NC,Adult,Vert.Ecto,,,Synodus sp.,Synodontidae Synodus sp. Adult,Synodontidae Synodus sp. 109,Platycephalus indicus A1,291,Platycephalidae,Platycephalus,indicus,291,C,Adult,Vert.Ecto,,,Platycephalus indicus (291mm),Platycephalidae Platycephalus indicus Adult ,Platycephalidae Platycephalus indicus 111,Parvocalanus crassirostris AM1,0.395,Paracalanidae,Parvocalanus,crassirostris,0.395,NC,Adult,Invert,M,,Parvocalanus crassirostris m,Paracalanidae Parvocalanus crassirostris Adult m,Paracalanidae Parvocalanus crassirostris 112,Parvocalanus crassirostris AF2,0.575,Paracalanidae,Parvocalanus,crassirostris,0.575,NC,Adult,Invert,F,,Parvocalanus crassirostris f,Paracalanidae Parvocalanus crassirostris Adult f,Paracalanidae Parvocalanus crassirostris 113,Corycaeus pacificus AF,2.24,Corycaeidae,Corycaeus ,pacificus,2.24,NC,Adult,Invert,F,,Corycaeus pacificusf,Corycaeidae Corycaeus pacificus Adult f,Corycaeidae Corycaeus pacificus 114,Corycaeus agilis AF,0.97,Corycaeidae,Corycaeus ,agilis,0.97,NC,Adult,Invert,F,,Corycaeus agilisf,Corycaeidae Corycaeus agilis Adult f,Corycaeidae Corycaeus agilis 115,Corycaeus lubbocki AF,0.935,Corycaeidae,Corycaeus,lubboki,0.935,NC,Adult,Invert,F,,Corycaeus lubbockif,Corycaeidae Corycaeus lubbocki Adult f,Corycaeidae Corycaeus lubbocki 116,Corycaeus dahli AF2,1.035,Corycaeidae,Corycaeus ,dahli,1.035,NC,Adult,Invert,F,,Corycaeus dahli f,Corycaeidae Corycaeus dahli Adult f,Corycaeidae Corycaeus dahli 117,Corycaeus dahli AM1,0.905,Corycaeidae,Corycaeus ,dahli,0.905,NC,Adult,Invert,M,,Corycaeus dahli m,Corycaeidae Corycaeus dahli Adult m,Corycaeidae Corycaeus dahli 118,Corycaeus andrewsi AF,0.745,Corycaeidae,Corycaeus ,andrewsi,0.745,NC,Adult,Invert,F,,Corycaeus andrewsi f,Corycaeidae Corycaeus andrewsi Adult f,Corycaeidae Corycaeus andrewsi 119,Acartia pacifica AM2,1.29,Acartiidae ,Acartia,pacifica,1.29,NC,Adult,Invert,M,,Acartia pacifica m,Acartiidae Acartia pacifica Adult m,Acartiidae Acartia pacifica120,Acartia pacifica AF1,1.475,Acartiidae ,Acartia,pacifica,1.475,NC,Adult,Invert,F,,Acartia pacifica f,Acartiidae Acartia pacifica Adult f,Acartiidae Acartia pacifica121,Acartia amboinensis AF2,1.455,Acartiidae,Acartia ,amboinensis,1.455,NC,Adult,Invert,F,,Acartia amboinensis f,Acartiidae Acartia amboinensis Adult f,Acartiidae Acartia amboinensis122,Acartia amboinensis AM1,1.31,Acartiidae,Acartia ,amboinensis,1.31,NC,Adult,Invert,M,,Acartia amboinensis m,Acartiidae Acartia amboinensis Adult m,Acartiidae Acartia amboinensis 123,Oithona attenuata AF2,0.67,Oithonidae,Oithona,attenuata,0.67,NC,Adult,Invert,F,,Oithona attenuata f,Oithonidae Oithona attenuata Adult f,Oithonidae Oithona attenuata 124,Oithona attenuata AM1,0.53,Oithonidae,Oithona,attenuata,0.53,NC,Adult,Invert,M,,Oithona attenuata m,Oithonidae Oithona attenuata Adult m,Oithonidae Oithona attenuata 125,Oithona simplex AF1,0.505,Oithonidae,Oithona,simplex,0.505,NC,Adult,Invert,F,,Oithona simplex f,Oithonidae Oithona simplex Adult f,Oithonidae Oithona simplex 126,Oithona simplex AM2,0.515,Oithonidae,Oithona,simplex,0.515,NC,Adult,Invert,M,,Oithona simplex m,Oithonidae Oithona simplex Adult m,Oithonidae Oithona simplex 127,Oithona plumifera AF,1.155,Oithonidae,Oithona,plumifera,1.155,NC,Adult,Invert,F,,Oithona plumifera f,Oithonidae Oithona plumifera Adult f,Oithonidae Oithona plumifera 128,Oncaea AM1,0.585,Oncaeidae,Oncaea,,0.585,NC,Adult,Invert,M,,Oncaea m,Oncaeidae Oncaea Adult m,Oncaeidae Oncaea 129,Oncaea AF2,0.695,Oncaeidae,Oncaea,,0.695,NC,Adult,Invert,F,,Oncaea f,Oncaeidae Oncaea Adult f,Oncaeidae Oncaea130,Microsetella sp. AF2,1.37,Ectinosomatidae,Microsetella,,1.37,NC,Adult,Invert,F,,Microsetella sp. f,Ectinosomatidae Microsetella sp. Adult f,Ectinosomatidae Microsetella sp. 131,Microsetella sp. AM1,0.56,Ectinosomatidae,Microsetella,,0.56,NC,Adult,Invert,M,,Microsetella sp. m,Ectinosomatidae Microsetella sp. Adult m,Ectinosomatidae Microsetella sp. 132,Euturpina acutifrons AF,0.7,Euterpinidae ,Euturpina,acutifrons,0.7,NC,Adult,Invert,F,,Euturpina acutifrons f,Euterpinidae Euturpina acutifrons Adult f,Euterpinidae Euturpina acutifrons 133,Acartia (Acartiella) faoensis AF2,1.025,Acartiidae,Acartia (Acartiella),faoensis,1.025,NC,Adult,Invert,F,,Acartia (Acartiella) faoensis f,Acartiidae Acartia (Acartiella) faoensis Adult f,Acartiidae Acartia (Acartiella) faoensis 134,Acartia (Acartiella) faoensis AM1,0.95,Acartiidae,Acartia (Acartiella),faoensis,0.95,NC,Adult,Invert,M,,Acartia (Acartiella) faoensis m,Acartiidae Acartia (Acartiella) faoensis Adult m,Acartiidae Acartia (Acartiella) faoensis 135,Subeucalanus subcrassus AF,2.33,Subeucalanidae,Subeucalanus,subcrassus,2.33,NC,Adult,Invert,F,,Subeucalanus subcrassus f,Subeucalanidae Subeucalanus subcrassus Adult f,Subeucalanidae Subeucalanus subcrassus 136,Centropages furcatus AF2,3.46,Centropagidae,Centropages,furcatus,3.46,NC,Adult,Invert,F,,Centropages furcatus f,Centropagidae Centropages furcatus Adult f,Centropagidae Centropages furcatus 137,Centropages furcatus AM1,1.6,Centropagidae,Centropages,furcatus,1.6,NC,Adult,Invert,M,,Centropages furcatus m,Centropagidae Centropages furcatus Adult m,Centropagidae Centropages furcatus 138,Centropages tenuiremis AF2,1.745,Centropagidae,Centropages,tenuiremis,1.745,NC,Adult,Invert,F,,Centropages tenuiremis f,Centropagidae Centropages tenuiremis Adult f,Centropagidae Centropages tenuiremis 139,Centropages tenuiremis AM1,1.6,Centropagidae,Centropages,tenuiremis,1.6,NC,Adult,Invert,M,,Centropages tenuiremis m,Centropagidae Centropages tenuiremis Adult m,Centropagidae Centropages tenuiremis 140,Centropages Orsinii AF,1.61,Centropagidae,Centropages,Orsinii,1.61,NC,Adult,Invert,F,,Centropages Orsinii f,Centropagidae Centropages Orsinii Adult f,Centropagidae Centropages Orsinii 141,Pseudodiaptomus arabicus AF2,1.31,Pseudodiaptomidae,Pseudodiaptomus,arabicus,1.31,NC,Adult,Invert,F,,Pseudodiaptomus arabicus f,Pseudodiaptomidae Pseudodiaptomus arabicus Adult f,Pseudodiaptomidae Pseudodiaptomus arabicus 142,Pseudodiaptomus arabicus AM1,1.095,Pseudodiaptomidae,Pseudodiaptomus,arabicus,1.095,NC,Adult,Invert,M,,Pseudodiaptomus arabicus m,Pseudodiaptomidae Pseudodiaptomus arabicus Adult m,Pseudodiaptomidae Pseudodiaptomus arabicus 143,Temora discaudata AF2,1.82,Temoridae,Temora,discaudata,1.82,NC,Adult,Invert,F,,Temora discaudata f,Temoridae Temora discaudata Adult f,Temoridae Temora discaudata 144,Temora discaudata AM1,1.81,Temoridae,Temora,discaudata,1.81,NC,Adult,Invert,M,,Temora discaudata m,Temoridae Temora discaudata Adult m,Temoridae Temora discaudata 145,Temora turbinata AF2,1.395,Temoridae,Temora,turbinata,1.395,NC,Adult,Invert,F,,Temora turbinata f,Temoridae Temora turbinata Adult f,Temoridae Temora turbinata 146,Temora turbinata AM1,1.295,Temoridae,Temora,turbinata,1.295,NC,Adult,Invert,M,,Temora turbinata m,Temoridae Temora turbinata Adult m,Temoridae Temora turbinata 147,Calanopia elliptica AF2,1.865,Pontellidae,Calanopia,elliptica,1.865,NC,Adult,Invert,F,,Calanopia elliptica f,Pontellidae Calanopia elliptica Adult f,Pontellidae Calanopia elliptica 148,Calanopia elliptica AM1,1.745,Pontellidae,Calanopia,elliptica,1.745,NC,Adult,Invert,M,,Calanopia elliptica m,Pontellidae Calanopia elliptica Adult m,Pontellidae Calanopia elliptica 149,Calanopia minor AF2,1.32,Pontellidae,Calanopia,minor,1.32,NC,Adult,Invert,F,,Calanopia minor f,Pontellidae Calanopia minor Adult f,Pontellidae Calanopia minor