288,Ophiothrix savignyi A,4.75,Ophiotrichidae,Ophiothrix,savignyi,4.75,NC,Adult,Invert,,,Ophiothrix savignyi,Ophiotrichidae Ophiothrix savignyi Adult,Ophiotrichidae Ophiothrix savignyi 289,Macrophiothrix elongata A,30,Ophiotrichidae,Macrophiothrix,elongata,30,NC,Adult,Invert,,,Macrophiothrix elongata (arms 20 times width of disc),Ophiotrichidae Macrophiothrix elongata Adult,Ophiotrichidae Macrophiothrix elongata 290,Macrophiothrix hirsuta A,25,Ophiotrichidae,Macrophiothrix,hirsuta,25,NC,Adult,Invert,,,Macrophiothrix hirsuta,Ophiotrichidae Macrophiothrix hirsuta Adult,Ophiotrichidae Macrophiothrix hirsuta 291,Paracrocnida persica A,9,Amphiuridae,Paracrocnida,persica,9,NC,Adult,Invert,,,Paracrocnida persica,Amphiuridae Paracrocnida persica Adult,Amphiuridae Paracrocnida persica 292,Ophionereis dubia A,8,Ophionereididae,Ophionereis,dubia,8,NC,Adult,Invert,,,Ophionereis dubia,Ophionereididae Ophionereis dubia Adult,Ophionereididae Ophionereis dubia 293,Echinometra mathaei A,46,Echinometridae,Echinometra,mathaei,46,NC,Adult,Chordate.Ecto,,,Echinometra mathaei,Echinometridae Echinometra mathaei Adult,Echinometridae Echinometra mathaei 294,Clypeaster humilis A,100,Clypeasteridae,Clypeaster,humilis,100,NC,Adult,Auto,,,Clypeaster humilis,Clypeasteridae Clypeaster humilis Adult,Clypeasteridae Clypeaster humilis 295,Clypeaster reticulatus (length) A,70,Clypeasteridae,Clypeaster,reticulatus,70,NC,Adult,Auto,,,Clypeaster reticulatus (length),Clypeasteridae Clypeaster reticulatus Adult ,Clypeasteridae Clypeaster reticulatus 296,Echinodiscus auritus (length) A,110,Astriclypeidae,Echinodiscus,auritus,110,NC,Adult,Auto,,,Echinodiscus auritus (length),Astriclypeidae Echinodiscus auritus Adult ,Astriclypeidae Echinodiscus auritus 297,Holothuria (Halodeima) atra (length) A,600,Holothuriidae,Holothuria (Halodeima),atra,600,NC,Adult,Auto,,,Holothuria (Halodeima) atra (length),Holothuriidae Holothuria (Halodeima) atra Adult ,Holothuriidae Holothuria (Halodeima) atra 298,Holothuria (Thymiosycia) arenicola (length) A,250,Holothuriidae,Holothuria (Thymiosycia),arenicola,250,NC,Adult,Auto,,,Holothuria (Thymiosycia) arenicola (length),Holothuriidae Holothuria (Thymiosycia) arenicola Adult ,Holothuriidae Holothuria (Thymiosycia) arenicola 299,Holothuria (Thymiosycia) hilla (length) A,200,Holothuriidae,Holothuria (Thymiosycia),hilla,200,NC,Adult,Auto,,,Holothuria (Thymiosycia) hilla (length),Holothuriidae Holothuria (Thymiosycia) hilla Adult ,Holothuriidae Holothuria (Thymiosycia) hilla 300,Holothuria (Thymiosycia) impatiens (length) A,150,Holothuriidae,Holothuria (Thymiosycia),impatiens,150,NC,Adult,Auto,,,Holothuria (Thymiosycia) impatiens (length),Holothuriidae Holothuria (Thymiosycia) impatiens Adult ,Holothuriidae Holothuria (Thymiosycia) impatiens301,Hemithyone semperi (length) A,50,Phyllophoridae,Hemithyone,semperi,50,NC,Adult,Auto,,,Hemithyone semperi (length),Phyllophoridae Hemithyone semperi Adult ,Phyllophoridae Hemithyone semperi 302,Pentacta loeppenthini (length) A,30,Cucumariidae,Pentacta,loeppenthini,30,NC,Adult,Auto,,,Pentacta loeppenthini (length),Cucumariidae Pentacta loeppenthini Adult ,Cucumariidae Pentacta loeppenthini303,Chthamalus malayensis A,8,Chthamalidae,Chthamalus,malayensis,8,NC,Adult,Auto,,,Chthamalus malayensis,Chthamalidae Chthamalus malayensis Adult,Chthamalidae Chthamalus malayensis 304,Euraphia sp. A,9,Chthamalidae,Euraphia,,9,NC,Adult,Auto,,,Euraphia sp. ,Chthamalidae Euraphia sp. Adult,Chthamalidae Euraphia sp. 305,Balanus tintinnabulum A,76,Balanidae,Balanus,tintinnabulum,76,NC,Adult,Auto,,,Balanus tintinnabulum,Balanidae Balanus tintinnabulum Adult,Balanidae Balanus tintinnabulum 306,Balanus amphitrite A,10,Balanidae,Balanus,amphitrite,10,NC,Adult,Auto,,,Balanus amphitrite,Balanidae Balanus amphitrite Adult,Balanidae Balanus amphitrite307,Octolasmic warwicki A,20,Poecilasmatidae,Octolasmic,warwicki,20,NC,Adult,Auto,,,Octolasmic warwicki,Poecilasmatidae Octolasmic warwicki Adult,Poecilasmatidae Octolasmic warwicki 308,Hydroides elegans A,30,Serpulidae,Hydroides,elegans,30,NC,Adult,Auto,,,Hydroides elegans,Serpulidae Hydroides elegans Adult,Serpulidae Hydroides elegans309,Pomatoleios kraussii A,25,Serpulidae,Pomatoleios,kraussii,25,NC,Adult,Auto,,,Pomatoleios kraussii,Serpulidae Pomatoleios kraussii Adult,Serpulidae Pomatoleios kraussii 310,Janua (Fauveldora) kayi A,10,Serpulidae,Janua (Fauveldora),kayi,10,NC,Adult,Auto,,,Janua (Fauveldora) kayi,Serpulidae Janua (Fauveldora) kayi Adult,Serpulidae Janua (Fauveldora) kayi 311,Paralepidonotus amppulliferus A,17,Polynoidae,Paralepidonotus,amppulliferus,17,NC,Adult,Auto,,,Paralepidonotus amppulliferus,Polynoidae Paralepidonotus amppulliferus Adult,Polynoidae Paralepidonotus amppulliferus 312,Harmothoe dictyophora A,25,Polynoidae,Harmothoe,dictyophora,25,NC,Adult,Auto,,,Harmothoe dictyophora,Polynoidae Harmothoe dictyophora Adult,Polynoidae Harmothoe dictyophora313,Lepidonotus carinulatus A,30,Polynoidae,Lepidonotus,carinulatus,30,NC,Adult,Auto,,,Lepidonotus carinulatus,Polynoidae Lepidonotus carinulatus Adult,Polynoidae Lepidonotus carinulatus 314,Lepidonotus tenuisetosus A,15,Polynoidae,Lepidonotus,tenuisetosus,15,NC,Adult,Auto,,,Lepidonotus tenuisetosus,Polynoidae Lepidonotus tenuisetosus Adult,Polynoidae Lepidonotus tenuisetosus 315,Thalenessa djiboutiensis A,150,Sigalionidae,Thalenessa,djiboutiensis,150,NC,Adult,Invert,,,Thalenessa djiboutiensis,Sigalionidae Thalenessa djiboutiensis Adult,Sigalionidae Thalenessa djiboutiensis316,Polydontes melanotus A,300,Acoetidae,Polydontes,melanotus,300,NC,Adult,Auto,,,Polydontes melanotus,Acoetidae Polydontes melanotus Adult,Acoetidae Polydontes melanotus317,Pseudoeurythoe hirsuta A,20,Amphinomidae,Pseudoeurythoe,hirsuta,20,NC,Adult,Invert,,,Pseudoeurythoe hirsuta,Amphinomidae Pseudoeurythoe hirsuta Adult,Amphinomidae Pseudoeurythoe hirsuta 318,Euphrosyne foliosa A,30,Euphrosinidae,Euphrosyne,foliosa,30,NC,Adult,Invert,,,Euphrosyne foliosa,Euphrosinidae Euphrosyne foliosa Adult,Euphrosinidae Euphrosyne foliosa 319,Eulaila viridis A,150,Phyllodocidae,Eulaila,viridis,150,NC,Adult,Invert,,,Eulaila viridis,Phyllodocidae Eulaila viridis Adult,Phyllodocidae Eulaila viridis 320,Leocrates claparedii A,60,Hesionidae,Leocrates,claparedii,60,NC,Adult,Invert,,,Leocrates claparedii,Hesionidae Leocrates claparedii Adult,Hesionidae Leocrates claparedii 321,Syllis spongicola A,25,Syllidae,Syllis,spongicola,25,NC,Adult,Auto,,,Syllis spongicola,Syllidae Syllis spongicola Adult,Syllidae Syllis spongicola 322,Syllis gracilis A,35,Syllidae,Syllis,gracilis,35,NC,Adult,Invert,,,Syllis gracilis,Syllidae Syllis gracilis Adult,Syllidae Syllis gracilis 323,Ceratonereis erythraeensis A,160,Nereididae,Ceratonereis,erythraeensis,160,NC,Adult,Invert,,,Ceratonereis erythraeensis,Nereididae Ceratonereis erythraeensis Adult,Nereididae Ceratonereis erythraeensis 324,Perinereis nuntia A,120,Nereididae,Perinereis,nuntia,120,NC,Adult,Invert,,,Perinereis nuntia,Nereididae Perinereis nuntia Adult,Nereididae Perinereis nuntia325,Perinereis cultrifera A,250,Nereididae,Perinereis,cultrifera,250,NC,Adult,Invert,,,Perinereis cultrifera ,Nereididae Perinereis cultrifera Adult,Nereididae Perinereis cultrifera 326,Perinereis nigropunctata A,60,Nereididae,Perinereis,nigropunctata,60,NC,Adult,Invert,,,Perinereis nigropunctata,Nereididae Perinereis nigropunctata Adult,Nereididae Perinereis nigropunctata 327,Tylonereis bogoyawlenski A,60,Nereididae,Tylonereis,bogoyawlenski,60,NC,Adult,Invert,,,Tylonereis bogoyawlenski,Nereididae Tylonereis bogoyawlenski Adult,Nereididae Tylonereis bogoyawlenski 328,Nephtys hombergii A,200,Nephtyidae,Nephtys,hombergii,200,NC,Adult,Invert,,,Nephtys hombergii,Nephtyidae Nephtys hombergii Adult,Nephtyidae Nephtys hombergii 329,Nephtys tulearensis A,80,Nephtyidae,Nephtys,tulearensis,80,NC,Adult,Invert,,,Nephtys tulearensis,Nephtyidae Nephtys tulearensis Adult,Nephtyidae Nephtys tulearensis 330,Glycera convoluta A,120,Glyceridae,Glycera,convoluta,120,NC,Adult,Auto,,,Glycera convoluta,Glyceridae Glycera convoluta Adult,Glyceridae Glycera convoluta 331,Goniadopsis incerta A,50,Goniadidae,Goniadopsis,incerta,50,NC,Adult,Invert,,,Goniadopsis incerta,Goniadidae Goniadopsis incerta Adult,Goniadidae Goniadopsis incerta 332,Eunice siciliensis A,300,Eunicidae,Eunice,siciliensis,300,NC,Adult,Invert,,,Eunice siciliensis,Eunicidae Eunice siciliensis Adult,Eunicidae Eunice siciliensis 333,Eunice atennata A,160,Eunicidae,Eunice,atennata,160,NC,Adult,Invert,,,Eunice atennata,Eunicidae Eunice atennata Adult,Eunicidae Eunice atennata 334,Eunice indica A,50,Eunicidae,Eunice,indica,50,NC,Adult,Invert,,,Eunice indica,Eunicidae Eunice indica Adult,Eunicidae Eunice indica 335,Marphysa sanguinea A,250,Eunicidae,Marphysa,sanguinea,250,NC,Adult,Invert,,,Marphysa sanguinea,Eunicidae Marphysa sanguinea Adult,Eunicidae Marphysa sanguinea336,Marphysa macintoshi A,200,Eunicidae,Marphysa,macintoshi,200,NC,Adult,Invert,,,Marphysa macintoshi,Eunicidae Marphysa macintoshi Adult,Eunicidae Marphysa macintoshi 337,Lysidice collaris A,75,Eunicidae,Lysidice,collaris,75,NC,Adult,Invert,,,Lysidice collaris,Eunicidae Lysidice collaris Adult,Eunicidae Lysidice collaris338,Diopatra sp. A,120,Onuphidae,Diopatra,,120,NC,Adult,Invert,,,Diopatra sp.,Onuphidae Diopatra sp. Adult,Onuphidae Diopatra sp. 339,Onuphis emerita A,120,Onuphidae,Onuphis,emerita,120,NC,Adult,Invert,,,Onuphis emerita,Onuphidae Onuphis emerita Adult,Onuphidae Onuphis emerita 340,Oenone fulgida A,350,Oenonidae,Oenone,fulgida,350,NC,Adult,Invert,,,Oenone fulgida,Oenonidae Oenone fulgida Adult,Oenonidae Oenone fulgida 341,Lumbrineris gracilis A,50,Lumbrineridae,Lumbrineris,gracilis,50,NC,Adult,Invert,,,Lumbrineris gracilis,Lumbrineridae Lumbrineris gracilis Adult,Lumbrineridae Lumbrineris gracilis 342,Arabella iricolor A,100,Oenonidae,Arabella,iricolor,100,NC,Adult,Invert,,,Arabella iricolor,Oenonidae Arabella iricolor Adult,Oenonidae Arabella iricolor 343,Scolelepis squamata A,80,Spionidae,Scolelepis,squamata,80,NC,Adult,Invert,,,Scolelepis squamata,Spionidae Scolelepis squamata Adult,Spionidae Scolelepis squamata 344,Prionospio pinnata A,60,Spionidae,Prionospio,pinnata,60,NC,Adult,Auto,,,Prionospio pinnata,Spionidae Prionospio pinnata Adult,Spionidae Prionospio pinnata 345,Prionospio rotalis A,25,Spionidae,Prionospio,rotalis,25,NC,Adult,Auto,,,Prionospio rotalis,Spionidae Prionospio rotalis Adult,Spionidae Prionospio rotalis 347,Cirriformia tentaculata A,20,Cirratulidae,Cirriformia,tentaculata,20,NC,Adult,Invert,,,Cirriformia tentaculata,Cirratulidae Cirriformia tentaculata Adult,Cirratulidae Cirriformia tentaculata 348,Timarete anchylochaeta A,10,Cirratulidae,Timarete,anchylochaeta,10,NC,Adult,Invert,,,Timarete anchylochaeta,Cirratulidae Timarete anchylochaeta Adult,Cirratulidae Timarete anchylochaeta 349,Phyllochaetopterus A,30,Cirratulidae,Phyllochaetopterus,,30,NC,Adult,Invert,,,Phyllochaetopterus,Cirratulidae Phyllochaetopterus Adult,Cirratulidae Phyllochaetopterus 350,Mesochaetopterus minutus A,15,Chaetopteridae,Mesochaetopterus,minutus,15,NC,Adult,Invert,,,Mesochaetopterus minutus,Chaetopteridae Mesochaetopterus minutus Adult,Chaetopteridae Mesochaetopterus minutus351,Naineris laevigata A,40,Nereididae,Naineris,laevigata,40,NC,Adult,Invert,,,Naineris laevigata,Nereididae Naineris laevigata Adult,Nereididae Naineris laevigata 352,Scoloplos chevalieri A,60,Orbiniidae,Scoloplos,chevalieri,60,NC,Adult,Invert,,,Scoloplos chevalieri,Orbiniidae Scoloplos chevalieri Adult,Orbiniidae Scoloplos chevalieri 353,Dasybranchus sp. (caducus?) A,300,Capitellidae,Dasybranchus,(caducus?),300,NC,Adult,Invert,,,Dasybranchus sp. (caducus?),Capitellidae Dasybranchus sp. (caducus?) Adult,Capitellidae Dasybranchus sp. (caducus?) 354,Petaloproctus terricola A,200,Maldanidae,Petaloproctus,terricola,200,NC,Adult,Invert,,,Petaloproctus terricola,Maldanidae Petaloproctus terricola Adult,Maldanidae Petaloproctus terricola 355,Melinna palmata A,50,Ampharetidae,Melinna,palmata,50,NC,Adult,Invert,,,Melinna palmata,Ampharetidae Melinna palmata Adult,Ampharetidae Melinna palmata 356,Owenia fusiformis A,100,Oweniidae,Owenia,fusiformis,100,NC,Adult,Invert,,,Owenia fusiformis,Oweniidae Owenia fusiformis Adult,Oweniidae Owenia fusiformis 357,Loimia medusa A,250,Terebellidae,Loimia,medusa,250,NC,Adult,Invert,,,Loimia medusa,Terebellidae Loimia medusa Adult,Terebellidae Loimia medusa 358,Megalomma quadrioculatum A,50,Sabellidae,Megalomma,quadrioculatum,50,NC,Adult,Invert,,,Megalomma quadrioculatum,Sabellidae Megalomma quadrioculatum Adult,Sabellidae Megalomma quadrioculatum 359,Sabella fusca A,80,Sabellidae,Sabella,fusca,80,NC,Adult,Invert,,,Sabella fusca,Sabellidae Sabella fusca Adult,Sabellidae Sabella fusca360,Oikopleura A,12.8,Oikopleuridae,Oikopleura,,12.8,NC,Adult,Chordate.Ecto,,,Oikopleura ,Oikopleuridae Oikopleura Adult,Oikopleuridae Oikopleura361,Chaetoceros sp.1 A,0.025,Chaetocerotaceae,Chaetoceros,sp.1,0.025,NC,Adult,Auto,,,Chaetoceros sp. A,Chaetocerotaceae Chaetoceros sp. A Adult,Chaetocerotaceae Chaetoceros sp. A362,Chaetoceros sp.2 A,0.075,Chaetocerotaceae,Chaetoceros,sp.2,0.075,NC,Adult,Auto,,,Chaetoceros sp. B,Chaetocerotaceae Chaetoceros sp. B Adult,Chaetocerotaceae Chaetoceros sp. B363,Rhizosolenia alata A,0.0925,Rhizosoleniaceae,Rhizosolenia,alata,0.0925,NC,Adult,Auto,,,Rhizosolenia alata,Rhizosoleniaceae Rhizosolenia alata Adult,Rhizosoleniaceae Rhizosolenia alata364,Rhiosolenla fragilissima A,0.1875,Rhizosoleniaceae,Rhiosolenla,fragilissima,0.1875,NC,Adult,Auto,,,Rhiosolenla fragilissima,Rhizosoleniaceae Rhiosolenla fragilissima Adult,Rhizosoleniaceae Rhiosolenla fragilissima 365,Rhizosolenia shrubsolei A,0.3,Rhizosoleniaceae,Rhizosolenia,shrubsolei,0.3,NC,Adult,Auto,,,Rhizosolenia shrubsolei,Rhizosoleniaceae Rhizosolenia shrubsolei Adult,Rhizosoleniaceae Rhizosolenia shrubsolei 366,Skeletonema costatum A,0.114,Skeletonemaceae,Skeletonema,costatum,0.114,NC,Adult,Auto,,,Skeletonema costatum,Skeletonemaceae Skeletonema costatum Adult,Skeletonemaceae Skeletonema costatum367,Stephanopyxis sp. A,0.12,Stephanopyxidaceae,Stephanopyxis,,0.12,NC,Adult,Auto,,,Stephanopyxis sp.,Stephanopyxidaceae Stephanopyxis sp. Adult,Stephanopyxidaceae Stephanopyxis sp.368,Thalassiosira sp. A2,0.017,Thalassiosiraceae,Thalassiosira,,0.017,NC,Adult,Auto,,,Thalassiosira sp.,Thalassiosiraceae Thalassiosira sp. Adult,Thalassiosiraceae Thalassiosira sp. 369,Licmophora sp. A,0.068,Licmophoraceae,Licmophora,,0.068,NC,Adult,Auto,,,Licmophora sp.,Licmophoraceae Licmophora sp. Adult,Licmophoraceae Licmophora sp.370,Navicula sp. A,0.015,Naviculaceae,Navicula,,0.015,NC,Adult,Auto,,,Navicula sp.,Naviculaceae Navicula sp. Adult,Naviculaceae Navicula sp. 371,Nitzschia longissima A,0.07,Bacillariaceae,Nitzschia,longissima,0.07,NC,Adult,Auto,,,Nitzschia longissima,Bacillariaceae Nitzschia longissima Adult,Bacillariaceae Nitzschia longissima 372,Pleurosigma sp. A,0.05,Pleurosigmataceae,Pleurosigma,,0.05,NC,Adult,Auto,,,Pleurosigma sp.,Pleurosigmataceae Pleurosigma sp. Adult,Pleurosigmataceae Pleurosigma sp. 373,Ceratium lineatum A,0.1,Ceratiaceae,Ceratium,lineatum,0.1,NC,Adult,Auto,,,Ceratium lineatum,Ceratiaceae Ceratium lineatum Adult,Ceratiaceae Ceratium lineatum 375,Coccolithus sp. A,0.0075,Coccolithaceae,Coccolithus,,0.0075,NC,Adult,Auto,,,Coccolithus sp.,Coccolithaceae Coccolithus sp. Adult,Coccolithaceae Coccolithus sp.376,Ciliate sp. 1 A,0.015,Lotidae,Ciliate,sp.1,0.015,NC,Adult,Auto,,,Ciliate sp. A,Lotidae Ciliate sp. A Adult,Lotidae Ciliate sp. A 377,Ciliate sp. 2 A,0.025,Lotidae,Ciliate,sp.2,0.025,NC,Adult,Auto,,,Ciliate sp. B,Lotidae Ciliate sp. B Adult,Lotidae Ciliate sp. B 378,Bacteriastrum sp. A,0.03,Chaetocerotaceae,Bacteriastrum,,0.03,NC,Adult,Bact,,,Bacteriastrum sp.,Chaetocerotaceae Bacteriastrum sp. Adult,Chaetocerotaceae Bacteriastrum sp.379,ANF spp. A,0.02,Bacteria,ANF,,0.02,NC,Adult,Bact,,,ANF spp.,ANF spp. Adult,ANF spp. 380,HNF spp. A,0.023,Bacteria,HNF,,0.023,NC,Adult,Bact,,,HNF spp.,HNF spp. Adult,HNF spp. 381,filamentous cyanobacteria A,0.02,Cyanobacteria,filamentous cyanobacteria,,0.02,NC,Adult,Bact,,,filamentous cyanobacteria,Cyanobacteria filamentous cyanobacteria Adult,Cyanobacteria filamentous cyanobacteria 382,Trichodesmium A1,0.021071429,Phormidiaceae,Trichodesmium,,0.021071429,NC,Adult,Bact,,,Trichodesmium-1,Phormidiaceae Trichodesmium Adult,Phormidiaceae Trichodesmium 383,Trichodesmium A2,0.022678571,Phormidiaceae,Trichodesmium,,0.022678571,NC,Adult,Bact,,,Trichodesmium-2,Phormidiaceae Trichodesmium Adult,Phormidiaceae Trichodesmium 384,Acartia (Acartiella) faoensis CI J,0.38,Acartiidae,Acartia (Acartiella),faoensis,0.38,NC,Juvenile,Invert,,,Acartia (Acartiella) faoensis CI,Acartiidae Acartia (Acartiella) faoensis Juvenile,Acartiidae Acartia (Acartiella) faoensis 385,Acartia (Acartiella) faoensis CII J,0.54,Acartiidae,Acartia (Acartiella),faoensis,0.54,NC,Juvenile,Invert,,,Acartia (Acartiella) faoensis CII,Acartiidae Acartia (Acartiella) faoensis Juvenile,Acartiidae Acartia (Acartiella) faoensis 386,Acartia (Acartiella) faoensis CIII J,0.65,Acartiidae,Acartia (Acartiella),faoensis,0.65,NC,Juvenile,Invert,,,Acartia (Acartiella) faoensis CIII,Acartiidae Acartia (Acartiella) faoensis Juvenile,Acartiidae Acartia (Acartiella) faoensis 387,Acartia (Acartiella) faoensis CIV J,0.75,Acartiidae,Acartia (Acartiella),faoensis,0.75,NC,Juvenile,Invert,,,Acartia (Acartiella) faoensis CIV,Acartiidae Acartia (Acartiella) faoensis Juvenile,Acartiidae Acartia (Acartiella) faoensis 388,Acartia (Acartiella) faoensis CV J,0.84,Acartiidae,Acartia (Acartiella),faoensis,0.84,NC,Juvenile,Invert,,,Acartia (Acartiella) faoensis CV,Acartiidae Acartia (Acartiella) faoensis Juvenile,Acartiidae Acartia (Acartiella) faoensis 389,Halodule uninervis (leaf width 2-5 mm) A,150,Cymodoceaceae,Halodule,uninervis,150,NC,Adult,Auto,,,Halodule uninervis (leaf width 2-5 mm),Cymodoceaceae Halodule uninervis Adult,Cymodoceaceae Halodule uninervis 390,Metapenaeus affinis Protozoea I L,0.745,Penaeidae,Metapenaeus,affinis,0.745,C,Larvae,Invert,,,Metapenaeus affinis Protozoea I ,Penaeidae Metapenaeus affinis larvae Protozoea ,Penaeidae Metapenaeus affinis 391,Metapenaeus affinis Protozoea II L,1.18,Penaeidae,Metapenaeus,affinis,1.18,C,Larvae,Invert,,,Metapenaeus affinis Protozoea II ,Penaeidae Metapenaeus affinis larvae Protozoea ,Penaeidae Metapenaeus affinis 392,Metapenaeus affinis Protozoea III L,1.87,Penaeidae,Metapenaeus,affinis,1.87,C,Larvae,Invert,,,Metapenaeus affinis Protozoea III ,Penaeidae Metapenaeus affinis larvae Protozoea ,Penaeidae Metapenaeus affinis 393,Metapenaeus affinis Mysis I L,2.48,Penaeidae,Metapenaeus,affinis,2.48,C,Larvae,Invert,,,Metapenaeus affinis Mysis I ,Penaeidae Metapenaeus affinis Mysis larvae,Penaeidae Metapenaeus affinis 394,Metapenaeus affinis Mysis II L,3.16,Penaeidae,Metapenaeus,affinis,3.16,C,Larvae,Invert,,,Metapenaeus affinis Mysis II ,Penaeidae Metapenaeus affinis Mysis larvae,Penaeidae Metapenaeus affinis 395,Metapenaeus affinis Mysis III L,3.545,Penaeidae,Metapenaeus,affinis,3.545,C,Larvae,Invert,,,Metapenaeus affinis Mysis III ,Penaeidae Metapenaeus affinis Mysis larvae,Penaeidae Metapenaeus affinis 396,Metapenaeus affinis postlarva I L,3.615,Penaeidae,Metapenaeus,affinis,3.615,C,Larvae,Invert,,,Metapenaeus affinis postlarva I ,Penaeidae Metapenaeus affinis postlarva larvae,Penaeidae Metapenaeus affinis 397,Metapenaeus affinis postlarva II L,4.87,Penaeidae,Metapenaeus,affinis,4.87,C,Larvae,Invert,,,Metapenaeus affinis postlarva II ,Penaeidae Metapenaeus affinis postlarva larvae,Penaeidae Metapenaeus affinis 398,Metapenaeus affinis postlarva III L,4.91,Penaeidae,Metapenaeus,affinis,4.91,C,Larvae,Invert,,,Metapenaeus affinis postlarva III ,Penaeidae Metapenaeus affinis postlarva larvae,Penaeidae Metapenaeus affinis 399,Metapenaeus affinis postlarva IV L,6.25,Penaeidae,Metapenaeus,affinis,6.25,C,Larvae,Invert,,,Metapenaeus affinis postlarva IV ,Penaeidae Metapenaeus affinis postlarva larvae,Penaeidae Metapenaeus affinis 400,Metapenaeus affinis postlarva V L,9.07,Penaeidae,Metapenaeus,affinis,9.07,C,Larvae,Invert,,,Metapenaeus affinis postlarva V ,Penaeidae Metapenaeus affinis postlarva larvae,Penaeidae Metapenaeus affinis 401,Metapenaeus affinis postlarva VI L,12.39,Penaeidae,Metapenaeus,affinis,12.39,C,Larvae,Invert,,,Metapenaeus affinis postlarva VI ,Penaeidae Metapenaeus affinis postlarva larvae,Penaeidae Metapenaeus affinis 402,Metapenaeus affinis postlarva VII L,14.46,Penaeidae,Metapenaeus,affinis,14.46,C,Larvae,Invert,,,Metapenaeus affinis postlarva VII ,Penaeidae Metapenaeus affinis postlarva larvae ,Penaeidae Metapenaeus affinis 403,Metapenaeus affinis Nauplius I L,0.23,Penaeidae,Metapenaeus,affinis,0.23,C,Larvae,Invert,,,Metapenaeus affinis Nauplius I ,Penaeidae Metapenaeus affinis Nauplius larvae,Penaeidae Metapenaeus affinis 404,Metapenaeus affinis Nauplius II L,0.255,Penaeidae,Metapenaeus,affinis,0.255,C,Larvae,Invert,,,Metapenaeus affinis Nauplius II ,Penaeidae Metapenaeus affinis Nauplius larvae,Penaeidae Metapenaeus affinis 405,Metapenaeus affinis Nauplius III L,0.27,Penaeidae,Metapenaeus,affinis,0.27,C,Larvae,Invert,,,Metapenaeus affinis Nauplius III ,Penaeidae Metapenaeus affinis Nauplius larvae,Penaeidae Metapenaeus affinis 406,Metapenaeus affinis Nauplius IV L,0.33,Penaeidae,Metapenaeus,affinis,0.33,C,Larvae,Invert,,,Metapenaeus affinis Nauplius IV ,Penaeidae Metapenaeus affinis Nauplius larvae,Penaeidae Metapenaeus affinis 407,Metapenaeus affinis Nauplius V L,0.38,Penaeidae,Metapenaeus,affinis,0.38,C,Larvae,Invert,,,Metapenaeus affinis Nauplius V ,Penaeidae Metapenaeus affinis Nauplius larvae,Penaeidae Metapenaeus affinis 408,Metapenaeus affinis Nauplius VI L,0.405,Penaeidae,Metapenaeus,affinis,0.405,C,Larvae,Invert,,,Metapenaeus affinis Nauplius VI ,Penaeidae Metapenaeus affinis Nauplius larvae,Penaeidae Metapenaeus affinis 409,Thalassiora sp. A1,0.015,Hydrocharitaceae,Thalassiora,,0.015,NC,Adult,Auto,,,Thalassiora sp.,Hydrocharitaceae Thalassiora sp. Adult,Hydrocharitaceae Thalassiora sp.410,Artemia nauplii L,0.05,Artemiidae,Artemia,nauplii,0.05,NC,Larvae,Invert,,,Artemia nauplii,Artemiidae Artemia nauplii larvae,Artemiidae Artemia 411,Penaeus semisulcateus E,0.295,Penaeidae,Penaeus,semisulcateus,0.295,C,Egg,Invert,,,Penaeus semisulcateus eggs,Penaeidae Penaeus semisulcateus eggs,Penaeidae Penaeus semisulcateus 412,Penaeus semisulcateus Nauplius I L,0.317,Penaeidae,Penaeus,semisulcateus,0.317,C,Larvae,Invert,,,Penaeus semisulcateus Nauplius I ,Penaeidae Penaeus semisulcateus Nauplius larvae,Penaeidae Penaeus semisulcateus 413,Penaeus semisulcateus Nauplius II L,0.344,Penaeidae,Penaeus,semisulcateus,0.344,C,Larvae,Invert,,,Penaeus semisulcateus Nauplius II ,Penaeidae Penaeus semisulcateus Nauplius larvae,Penaeidae Penaeus semisulcateus 414,Penaeus semisulcateus Nauplius III L,0.387,Penaeidae,Penaeus,semisulcateus,0.387,C,Larvae,Invert,,,Penaeus semisulcateus Nauplius III ,Penaeidae Penaeus semisulcateus Nauplius Iarvae,Penaeidae Penaeus semisulcateus 415,Penaeus semisulcateus Nauplius IV L,0.415,Penaeidae,Penaeus,semisulcateus,0.415,C,Larvae,Invert,,,Penaeus semisulcateus Nauplius IV,Penaeidae Penaeus semisulcateus Nauplius Iarvae,Penaeidae Penaeus semisulcateus 416,Penaeus semisulcateus Nauplius V L,0.447,Penaeidae,Penaeus,semisulcateus,0.447,C,Larvae,Invert,,,Penaeus semisulcateus Nauplius V,Penaeidae Penaeus semisulcateus Nauplius larvae,Penaeidae Penaeus semisulcateus 417,Penaeus semisulcateus Nauplius VI L,0.578,Penaeidae,Penaeus,semisulcateus,0.578,C,Larvae,Invert,,,Penaeus semisulcateus Nauplius VI,Penaeidae Penaeus semisulcateus Nauplius larvae,Penaeidae Penaeus semisulcateus 418,Penaeus semisulcateus Protozoea I L,1.2,Penaeidae,Penaeus,semisulcateus,1.2,C,Larvae,Invert,,,Penaeus semisulcateus Protozoea I,Penaeidae Penaeus semisulcateus Protozoea larvae,Penaeidae Penaeus semisulcateus 419,Penaeus semisulcateus Protozoea II L,1.506,Penaeidae,Penaeus,semisulcateus,1.506,C,Larvae,Invert,,,Penaeus semisulcateus Protozoea II,Penaeidae Penaeus semisulcateus Protozoea Iarvae,Penaeidae Penaeus semisulcateus 420,Penaeus semisulcateus Protozoea III L,2.589,Penaeidae,Penaeus,semisulcateus,2.589,C,Larvae,Invert,,,Penaeus semisulcateus Protozoea III,Penaeidae Penaeus semisulcateus Protozoea larvae,Penaeidae Penaeus semisulcateus 421,Penaeus semisulcateus Mysis I L,2.913,Penaeidae,Penaeus,semisulcateus,2.913,C,Larvae,Invert,,,Penaeus semisulcateus Mysis I,Penaeidae Penaeus semisulcateus Mysis larvae,Penaeidae Penaeus semisulcateus 422,Penaeus semisulcateus Mysis II L,3.29,Penaeidae,Penaeus,semisulcateus,3.29,C,Larvae,Invert,,,Penaeus semisulcateus Mysis II,Penaeidae Penaeus semisulcateus Mysis larvae,Penaeidae Penaeus semisulcateus 423,Penaeus semisulcateus Mysis III L,3.92,Penaeidae,Penaeus,semisulcateus,3.92,C,Larvae,Invert,,,Penaeus semisulcateus Mysis III,Penaeidae Penaeus semisulcateus Mysis larvae,Penaeidae Penaeus semisulcateus 424,Penaeus semisulcateus postlarva I L,5.324,Penaeidae,Penaeus,semisulcateus,5.324,C,Larvae,Invert,,,Penaeus semisulcateus postlarva I,Penaeidae Penaeus semisulcateus postlarva larvae,Penaeidae Penaeus semisulcateus 425,Metapenaeus affinis E2,0.24,Penaeidae,Metapenaeus,affinis,0.24,C,Egg,Invert,,,Metapenaeus affinis (eggs),Penaeidae Metapenaeus affinis Egg,Penaeidae Metapenaeus affinis426,Metapenaeus affinis Embryonic mass E1,0.14,Penaeidae,Metapenaeus,affinis,0.14,C,Egg,Invert,,,Metapenaeus affinis Embryonic mass,Penaeidae Metapenaeus affinis Embryonic mass Egg,Penaeidae Metapenaeus affinis 427,Chaetomorpha aerea A,100,Cladophoraceae,Chaetomorpha,aerea,100,NC,Adult,Auto,,,Chaetomorpha aerea,Cladophoraceae Chaetomorpha aerea Adult,Cladophoraceae Chaetomorpha aerea 